Id,Artist,Title,Wks,T10,PK,Pkstreams,Total,ReleaseDate,Popularity,Genre,Unique_Listener
4265,Logic,Midnight,2,,66,"7,257,929","11,411,874",6/13/2025,78,"east coast hip hop, hip hop, pop rap",77406
4266,Angelina Mango,La noia,1,,95,"11,411,679","11,411,679",1982,39,"europop, eurovision 2024 artists",100272
4267,Future,Life Is Good,2,,128,"6,143,239","730,795,312",1/10/2020,72,"english, hip hop, southern hip hop, trap, trap rap",12301
4268,21 Savage,3AM on Glenwood,1,,74,"11,386,762","11,386,762",11/4/2022,56,"gangsta rap, hip hop, mumble rap, pop rap, southern hip hop, trap",229839
4269,BIGBANG,Still Life,2,,148,"5,944,671","11,383,736",4/5/2022,61,"2000s, 2010s, 2nd gen k-pop, alliteration, boy group, hip hop, k-pop, kpop, pop, yg family",85220
4270,Matt Terry,Sucker for You,3,,176,"3,886,564","11,382,364",10/13/2017,56,"electronic, trance",55310
4271,Lana Del Rey,"Henry, come on",1,,85,"11,381,780","11,381,780",4/11/2025,67,"2010s, 2020s, alternative, alternative pop, art pop, ballad, chamber pop, dream pop, electronic, hawaiian glam metal, indie pop, millennial, neo-psychedelia, pop, sad girl pop, singer-songwriter, trip hop, tumblr",311735
4272,"Tyler, The Creator",LEMONHEAD,1,,47,"11,380,679","11,380,679",8/2/2019,41,"hip hop, kpop",205842
4273,Harry Styles,Cherry,1,,45,"11,371,850","11,371,850",1985,79,"2020s, funk, new wave, nuno, pop, rock, soft rock, soul, synth-pop",689753
4274,Drake,The Remorse,1,,57,"11,368,884","11,368,884",9/3/2021,58,"hip hop, kpop",168211
4275,Jonas Brothers,X,2,,92,"6,344,615","11,363,207",2/13/2025,61,"pop rock, teen pop",6971
4276,XXXTENTACION,I don’t let go,1,,39,"11,353,192","11,353,192",12/7/2018,63,"death by murder, emo rap, hip hop, rap, southern hip hop, trap, trap metal",134058
4277,Duki,Unfollow,2,,149,"5,871,053","11,344,450",5/31/2024,12,trap latino,32494
4278,Peso Pluma,VVS,1,,79,"11,328,963","11,328,963",11/21/2020,46,"corrido tumbado, regional mexicano",55906
4279,Frank Sinatra,Let It Snow! Let It Snow! Let It Snow!,1,,124,"11,320,306","505,030,248",1/1/1959,66,"acting, actors, big band, christmas, christmas music, easy listening, jazz, lounge, motion picture producers and directors, motion pictures--production and direction, pop, singers, singing, standards, swing, traditional pop, ultimate, vocal, vocal jazz",239979
4280,Bad Bunny,Una Velita,1,,104,"11,319,074","11,319,074",9/19/2024,60,"hip hop, latin, latin trap, reggaeton, trap latino",61893
4281,J. Cole,She's Mine Pt. 2,2,,40,"8,440,556","11,316,640",12/9/2016,62,hip hop,239761
4282,Lana Del Rey,Chemtrails Over The Country Club,2,,138,"5,892,021","11,310,837",3/19/2021,79,"2010s, 2020s, alternative, alternative pop, art pop, ballad, chamber pop, dream pop, electronic, hawaiian glam metal, indie pop, millennial, neo-psychedelia, pop, sad girl pop, singer-songwriter, trip hop, tumblr",982306
4283,j-hope,NEURON,1,,94,"11,307,544","11,307,544",3/29/2024,66,"dance-pop, hip hop, k-pop, pop, r&b",2050
4284,Future,Claustrophobic,1,,94,"11,306,391","11,306,391",3/22/2024,57,"english, hip hop, southern hip hop, trap, trap rap",256629
4285,ROSÉ,Messy (From F1® The Movie),1,,90,"11,304,588","11,304,588",5/8/2025,81,"dance, dance and electronica, dance-pop, dutch, dutch trance, edm, electro house, electronic, english, house, progressive house, progressive trance, remixes, tech trance, trance, uplifting trance, vinyl",169510
4286,Kanye West,Wolves,4,,70,"4,043,543","11,304,187",10/25/2017,76,"chipmunk soul, christian hip hop, conscious hip hop, electropop, experimental hip hop, gospel, hip hop, nazi, pop, pop rap, pro trump, producer, progressive rap, trap",720743
4287,Bad Bunny,ANTES QUE SE ACABE,1,,53,"11,298,839","11,298,839",11/27/2020,69,"hip hop, latin, latin trap, reggaeton, trap latino",101538
4288,Mumford & Sons,Snake Eyes,5,,80,"3,198,085","11,298,229",1/19/2024,21,"alt-country, alternative rock, americana, folk pop, folk rock, indie folk, pop rock, rock, stomp and holler",168272
4289,Linkin Park,Up From the Bottom,1,,88,"11,278,768","11,278,768",3/27/2025,71,"alt rock, alternative metal, alternative rock, metal, nu metal, rap metal, rap rock, rock",230073
4290,Coleman Hell,2 Heads,11,,134,"1,629,920","11,265,663",10/14/2016,49,"alternative pop, dance, edm, indie pop, seen live",125740
4291,KAJ,Bara Bada Bastu,1,,88,"11,259,586","11,259,586",5/9/2025,65,"comedy, musical",114761
4292,Taylor Swift,closure,1,,70,"11,245,393","11,245,393",9/17/2021,55,"2000s, 2010s, 2020s, alternative pop, artist of the decade, contemporary country, 
country, country pop, cultural icon, electropop, female vocals, icon, indie folk, late 2000s, millennial, 
nuno, pop, pop rock, re-recording, singer-songwriter, singer/songwriter, synth-pop, love",433693
4293,Beyoncé,PROTECTOR,1,,95,"11,235,625","11,235,625",5/3/2010,57,"2000s, 2010s, 2020s, adult contemporary, alternative r&b, american, americana, contemporary r&b, country, cultural icon, dance, dance-pop, dancer, disco, electropop, funk, grammy winner, hip hop, house, pianist, pop, pop rap, pop soul, progressive house, r&b, singer-songwriter, soul, vocalist",290897
4294,Michelle Williams,Tightrope,3,,189,"3,834,453","11,232,588",12/8/2017,68,"hip hop, kpop",202742
4295,Lady Gaga,Zombieboy,1,,95,"11,231,320","11,231,320",3/7/2025,71,"2000s, 2010s, 2020s, adult contemporary, americana, dance, dance-pop, electro house, electronic, electropop, film soundtrack, industrial pop, jazz, late 2000s, millennial, pop, pop rock, synth-pop, synthpop",398057
4296,Migos,Gang Gang,2,,80,"6,973,684","11,229,529",2/4/2025,71,"hip hop, southern hip hop, trap",69265
4297,¥$,HOODRAT,1,,98,"11,213,960","11,213,960",2/9/2024,53,"hip hop, hip house",150230
4298,Morgan Wallen,Superman,1,,89,"11,213,349","11,213,349",5/26/2002,82,"country, country pop",49388
4299,Ufo361,Pass auf wen du liebst,2,,111,"6,051,802","11,193,384",8/9/2019,53,"cloud rap, hip hop, trap",24530
4300,Kanye West,Hands On,1,,43,"11,183,853","11,183,853",6/18/2017,36,"hip hop, kpop",269191
4301,A$AP Rocky,L$D,7,,56,"2,427,529","11,182,098",5/26/2015,74,"cloud rap, east coast hip hop, experimental hip hop, hardcore hip hop, hip hop, pop rap, trap",885955
4302,Twenty One Pilots,Choker,2,,127,"6,023,200","11,173,376",5/21/2021,63,"alternative electronic, alternative hip hop, alternative pop, alternative rap, alternative rock, electropop, hip hop, indie, indie pop, indietronica, piano rock, pop rap, rap",229805
4303,JISOO,All Eyes On Me,1,,83,"11,128,082","11,128,082",3/31/2023,61,"2020s, 3rd gen k-pop, k-pop",191273
4304,Post Malone,Wrong Ones (Feat. Tim McGraw),1,,103,"11,120,704","11,120,704",8/15/2024,68,"2010s, 2020s, alternative r&b, cloud rap, contemporary r&b, country, english, hip hop, pop rap, r&b, trap",110691
4305,Lil Tecca,Shots,2,,107,"6,131,471","11,118,271",5/4/2015,59,"east coast hip hop, hip hop, pop rap, trap",206137
4306,Tate McRae,bloodonmyhands,1,,109,"11,114,404","11,114,404",2/24/2025,69,"2020s, alternative pop, contemporary r&b, dance-pop, female vocals, pop, pop rock",1289
4307,Pharrell Williams,Down In Atlanta,1,,60,"11,105,872","11,105,872",11/18/2022,60,"contemporary r&b, hip hop, pop, pop rap, pop soul, producer tag - pharrell, soul",255853
4308,Kanye West,Donda,1,,52,"11,098,736","11,098,736",8/29/2021,66,"chipmunk soul, christian hip hop, conscious hip hop, electropop, experimental hip hop, gospel, hip hop, nazi, pop, pop rap, pro trump, producer, progressive rap, trap",396119
4309,Future,Hard Work Pays Off,2,,96,"6,291,947","11,094,352",10/19/2018,61,"english, hip hop, southern hip hop, trap, trap rap",174516
4310,LISTENBEE,Save Me,8,,117,"1,818,218","11,088,831",2/13/2019,49,"hip hop, kpop",105911
4311,Bo Burnham,All Eyes On Me,2,,152,"5,725,908","11,073,171",3/31/2023,61,"acoustic, cover songs, detroit, dirtdoggy productions, dj scoob, hip hop, kalamazoo, michigan, pop, r&b, rock, scoob",246671
4312,Kendrick Lamar,untitled 02 | 06.23.2014.,3,,42,"6,179,535","11,071,650",3/4/2016,62,"2010s, 2020s, alternative hip hop, conscious hip hop, hardcore hip hop, hip hop, jazz rap, pop, pop rap, rap, trap, west coast hip hop",458513
4313,Dennis Lloyd,Never Go Back,2,,120,"6,215,791","11,069,446",9/11/2024,51,"english, pop, r&b, reggae",84782
4314,Bad Bunny,SORRY PAPI,1,,59,"11,066,606","11,066,606",11/27/2020,69,"hip hop, latin, latin trap, reggaeton, trap latino",120972
4315,Taylor Swift,Everything Has Changed,1,,54,"11,063,569","11,063,569",11/12/2021,71,"2000s, 2010s, 2020s, alternative pop, artist of the decade, contemporary country, 
country, country pop, cultural icon, electropop, female vocals, icon, indie folk, late 2000s, millennial, 
nuno, pop, pop rock, re-recording, singer-songwriter, singer/songwriter, synth-pop, love",427791
4316,Sam Smith,One Last Song,2,,73,"6,829,965","11,063,179",8/22/2014,85,"alliteration, alternative r&b, blue-eyed soul, english, lgbtqi, nuno, pop, pop soul, queer, soul, synth funk",109641
4317,Lil Uzi Vert,The Way Life Goes,3,,158,"3,916,937","11,057,702",8/25/2017,78,"2010s, 2020s, cloud rap, east coast hip hop, emo rap, hip hop, millennial, pop rap, rage, trap",43225
4318,Blueface,Thotiana,2,,135,"5,538,309","11,050,567",12/18/2018,72,"gangsta rap, hip hop, trap, west coast hip hop",268584
4319,Charli xcx,"The girl, so confusing version with lorde",1,,98,"11,036,482","11,036,482",7/20/2024,31,"2010s, 2020s, bubblegum bass, dance-pop, deconstructed club, electronic, electropop, europop, experimental hip hop, experimental pop, hyperpop, pc music, pop, synth-pop, uk",479386
4320,Jorja Smith,I Am,2,,90,"6,353,371","11,036,336",4/10/2023,75,"alternative r&b, neo soul, sophisti-pop",262013
4321,PARTYNEXTDOOR,SOMETHING ABOUT YOU,1,,109,"11,026,334","11,026,334",8/27/2021,80,"alternative r&b, canadian, contemporary r&b, partynextdoor, r&b, soul, trap soul",209357
4322,The Weeknd,Given Up On Me,1,,119,"11,022,808","11,022,808",1/31/2025,69,"2010s, 2020s, alternative r&b, contemporary r&b, dance-pop, hypnagogic pop, pop, r&b, synth-pop",277459
4323,Sam Hunt,Take Your Time,14,,146,"1,489,537","11,014,317",10/24/2014,64,"bro-country, contemporary country, contemporary r&b, country, country pop, pop",116743
4324,BTS,Airplane pt.2,2,,82,"6,348,328","11,008,618",5/18/2018,69,edm,482987
4325,Ed Sheeran,Curtains,1,,75,"11,006,373","11,006,373",5/5/2023,61,"dance-pop, folk, folk pop, guitarist, music for soccer moms, persian pop, pop, singer, singer-songwriter, soft rock, uk",92825
4326,AYLIVA,Wunder,1,,128,"11,000,908","11,000,908",4/26/2024,64,"european rap, german pop, german rap, hip hop, pop",32501
4327,XXXTENTACION,"ALONE, PART 3",2,,89,"6,379,554","10,984,028",3/16/2018,63,"death by murder, emo rap, hip hop, rap, southern hip hop, trap, trap metal",271498
4328,Beyoncé,MY HOUSE,1,,107,"10,978,414","10,978,414",3/8/2024,70,"2000s, 2010s, 2020s, adult contemporary, alternative r&b, american, americana, contemporary r&b, country, cultural icon, dance, dance-pop, dancer, disco, electropop, funk, grammy winner, hip hop, house, pianist, pop, pop rap, pop soul, progressive house, r&b, singer-songwriter, soul, vocalist",247196
4329,Kendrick Lamar,Savior - Interlude,1,,73,"10,975,882","10,975,882",5/13/2022,55,"2010s, 2020s, alternative hip hop, conscious hip hop, hardcore hip hop, hip hop, jazz rap, pop, pop rap, rap, trap, west coast hip hop",472239
4330,Travis Scott,KICK OUT,1,,96,"10,974,582","10,974,582",7/13/2025,77,"2000s, 2010s, bass house, house, techno",271083
4331,Noah Kahan,Forever,1,,108,"10,972,110","10,972,110",1984,82,"folk pop, pop",203829
4332,Studio Killers,Jenny,2,,180,"5,605,962","10,970,185",12/4/2020,70,"hip hop, kpop",90119
4333,Becky Hill,Remember (and David Guetta),2,,183,"5,557,982","10,967,035",8/6/2021,17,"house, pop",45303
4334,Playboi Carti,LIKE WEEZY,1,,121,"10,963,305","10,963,305",3/14/2025,68,"cloud rap, english, hip hop, plugg, rage, rap, southern hip hop, trap",335140
4335,Bad Bunny,120,1,,63,"10,957,181","10,957,181",9/11/2025,24,"hip hop, latin, latin trap, reggaeton, trap latino",138449
4336,Bonez MC,Fuckst mich nur ab,2,,112,"6,056,252","10,954,772",9/10/2020,54,"deutschrap, gangsta rap, german, hip hop, pop rap, rap, trap",11553
4337,MACHETE,YOSHI,2,,118,"5,952,166","10,953,128",8/14/2025,49,"hip hop, kpop",151
4338,Frank Ocean,Thinkin Bout You,2,,143,"8,435,333","10,948,576",7/10/2012,83,"_edit, _private tag 1, emo",2038873
4339,J. Cole,Once an Addict - Interlude,1,,51,"10,944,009","10,944,009",4/20/2018,53,hip hop,104195
4340,Ariana Grande,six thirty,1,,51,"10,941,573","10,941,573",10/30/2020,57,"contemporary r&b, dance-pop, pop, r&b, trap soul",294925
4341,Oasis,Don't Look Back in Anger - Remastered,1,,104,"10,922,416","10,922,416",10/2/1995,77,"acoustic rock, alternative rock, british, britpop, hard rock, indie, indie rock, neo-psychedelia, noise pop, pop rock, post-britpop, psychedelic rock, rock",926820
4342,Luan Santana,ABALO EMOCIONAL - Ao Vivo,2,,181,"5,511,448","10,916,173",8/8/2022,51,"country, pop, sertaneja, sertanejo, sertanejo universitário, singer-songwriter",64638
4343,Kanye West,Keep My Spirit Alive,1,,56,"10,913,129","10,913,129",8/29/2021,52,"chipmunk soul, christian hip hop, conscious hip hop, electropop, experimental hip hop, gospel, hip hop, nazi, pop, pop rap, pro trump, producer, progressive rap, trap",413988
4344,Eminem,Untouchable,2,,88,"6,474,296","10,909,744",4/9/2021,64,"actor, boom bap, conscious hip hop, detroit, detroit hip hop, hardcore hip hop, hip hop, hip-hop, horrorcore, midwest hip hop, midwestern hip-hop, music trade, pop rap, rap, record producer, singer, songwriter, trap",69925
4345,Kanye West,Jesus Lord,1,,57,"10,900,265","10,900,265",8/29/2021,53,"chipmunk soul, christian hip hop, conscious hip hop, electropop, experimental hip hop, gospel, hip hop, nazi, pop, pop rap, pro trump, producer, progressive rap, trap",371558
4346,Twenty One Pilots,The Line (from the series Arcane League of Legends),1,,128,"10,884,238","10,884,238",11/23/2024,75,"alternative electronic, alternative hip hop, alternative pop, alternative rap, alternative rock, electropop, hip hop, indie, indie pop, indietronica, piano rock, pop rap, rap",233523
4347,i-dle,TOMBOY,2,,189,"5,484,302","10,877,801",2/28/2019,65,"4th gen k-pop, girl crush, girl group, k-pop, pop",109137
4348,PARTYNEXTDOOR,SOMEBODY LOVES ME,1,,115,"10,877,402","10,877,402",2/14/2025,80,"alternative r&b, canadian, contemporary r&b, partynextdoor, r&b, soul, trap soul",208402
4349,Frenna,Verleden Tijd,2,,111,"5,689,674","10,876,703",5/23/2024,51,"hip hop, pop rap",21869
4350,Family of the Year,Hero,17,,166,"1,288,410","10,871,462",6/24/2016,64,"folk pop, folk rock, indie pop, pop rock",384682
4351,Zach Bryan,Spotless,1,,82,"10,870,508","10,870,508",9/13/2024,52,"alternative country, americana, country, red dirt",615
4352,Taylor Swift,Wildest Dreams,2,,171,"5,699,022","10,869,274",1/1/2014,75,"2000s, 2010s, 2020s, alternative pop, artist of the decade, contemporary country, 
country, country pop, cultural icon, electropop, female vocals, icon, indie folk, late 2000s, millennial, 
nuno, pop, pop rock, re-recording, singer-songwriter, singer/songwriter, synth-pop, love",1150232
4353,Britney Spears,Pretty Girls,9,,127,"1,658,763","10,868,026",5/4/2015,54,mashup,190446
4354,KC Rebell,DNA,2,,128,"5,987,137","10,839,793",8/24/2018,66,"german, hip hop, rap, trap",20983
4355,SZA,Smoking on my Ex Pack,1,,96,"10,834,231","10,834,231",12/9/2022,59,"alternative r&b, american, contemporary r&b, electronic, hip hop soul, neo soul, pop, r&b",572888
4356,Eminem,Premonition - Intro,1,,57,"10,830,400","10,830,400",1/17/2020,48,chiptune,122185
4357,Apache 207,Unterwegs,2,,134,"5,901,418","10,814,696",1/11/1988,36,"german, hip hop, rap",16216
4358,Baby Lasagna,Rim Tim Tagi Dim,1,,123,"10,807,462","10,807,462",1/12/2024,60,"croatia, eurovision 2024 artists, pop punk, rock, singer-songwriter",127988
4359,Taylor Swift,The Last Time,1,,58,"10,799,411","10,799,411",11/12/2021,68,"2000s, 2010s, 2020s, alternative pop, artist of the decade, contemporary country, 
country, country pop, cultural icon, electropop, female vocals, icon, indie folk, late 2000s, millennial, 
nuno, pop, pop rock, re-recording, singer-songwriter, singer/songwriter, synth-pop, love",231628
4360,Noah Kahan,Dial Drunk,1,,80,"10,782,828","10,330,089",6/9/2023,68,"folk pop, pop",269035
4361,Drake,Preach,6,,57,"3,057,433","10,768,233",2/12/2015,69,"hip hop, kpop",298122
4362,Taylor Swift,Stay Stay Stay (Taylor's Version),1,,59,"10,767,008","10,767,008",11/12/2021,62,"2000s, 2010s, 2020s, alternative pop, artist of the decade, contemporary country, 
country, country pop, cultural icon, electropop, female vocals, icon, indie folk, late 2000s, millennial, 
nuno, pop, pop rock, re-recording, singer-songwriter, singer/songwriter, synth-pop, love",428846
4363,will.i.am,Boys & Girls,5,,157,"2,317,363","10,758,693",11/3/2015,44,"hip hop, pop and chart, pop rap",64094
4364,Drake,Intro,1,,61,"10,737,639","10,737,639",3/8/2024,77,"hip hop, kpop",286850
4365,Offset,SAY MY GRACE,1,,93,"10,736,180","10,736,180",10/13/2023,69,"hip hop, southern hip hop, trap",3357
4366,Bad Bunny,TRELLAS,1,,66,"10,733,416","10,733,416",11/27/2020,61,"hip hop, latin, latin trap, reggaeton, trap latino",72997
4367,Kygo,Freedom,2,,99,"6,145,334","10,719,057",7/2/2015,69,"dance, deep house, downtempo, edm, electronica, english, house, tropical house",103919
4368,J. Cole,c l o s e,1,,55,"10,712,648","10,712,648",5/14/2021,55,hip hop,190795
4369,Playboi Carti,OPM BABI,1,,127,"10,704,466","10,704,466",3/14/2025,64,"cloud rap, english, hip hop, plugg, rage, rap, southern hip hop, trap",328481
4370,OneRepublic,Wanted,2,,112,"6,185,171","10,702,912",10/26/2018,63,"folk pop, pop, pop rock, rock",85195
4371,Loredana,Jetzt rufst du an,2,,117,"6,003,625","10,697,729",9/13/2019,49,"german, hip hop, rap",13658
4372,Bosh,Djomb,2,,113,"5,767,253","10,691,967",12/19/2022,48,"hip hop, kpop",3253
4373,Kendrick Lamar,Mirror,1,,76,"10,691,830","10,691,830",3/15/2013,82,"2010s, 2020s, alternative hip hop, conscious hip hop, hardcore hip hop, hip hop, jazz rap, pop, pop rap, rap, trap, west coast hip hop",544191
4374,The Weeknd,Take Me Back To LA,1,,128,"10,686,469","10,686,469",1/31/2025,68,"2010s, 2020s, alternative r&b, contemporary r&b, dance-pop, hypnagogic pop, pop, r&b, synth-pop",256590
4375,Parangolé,Perna Bamba,1,,113,"10,683,040","10,683,040",10/2/2025,65,"hip hop, kpop",62709
4376,NLE Choppa,Shotta Flow 5,2,,93,"6,167,338","10,681,320",8/7/2020,56,"gangsta rap, hardcore hip hop, hip hop, pop rap, southern hip hop, trap",120711
4377,Farruko,El Incomprendido,2,,161,"5,402,315","10,666,001",9/30/2021,58,"latin, latin urban, reggaeton, trap latino",46305
4378,True Damage,GIANTS,2,,132,"5,346,208","10,662,332",11/10/2019,53,"hip hop, kpop",207388
4379,Kenshi Yonezu,IRIS OUT,1,,94,"10,655,541","21,330,331",9/15/2025,85,"alternative rock, contemporary r&b, j-pop, j-rock, singer-songwriter",35676
4380,Metro Boomin,I Can't Save You (Interlude) [with Future & feat. Don Toliver],1,,92,"10,649,362","10,649,362",12/2/2022,69,"hip hop, trap",575800
4381,KHEA,WACHA,2,,153,"5,471,802","10,644,801",4/1/2021,59,trap latino,30767
4382,The Weeknd,A Tale By Quincy,1,,54,"10,644,730","10,644,730",1/6/2022,53,"2010s, 2020s, alternative r&b, contemporary r&b, dance-pop, hypnagogic pop, pop, r&b, synth-pop",393005
4383,G-Eazy,Lady Killers II (Christoph Andersson Remix),1,,106,"10,636,392","10,636,392",2/1/2022,65,"hip hop, trap",57494
4384,Lil Uzi Vert,Endless Fashion,1,,92,"10,626,345","10,626,345",6/30/2023,59,"2010s, 2020s, cloud rap, east coast hip hop, emo rap, hip hop, millennial, pop rap, rage, trap",1090
4385,Linkin Park,What I've Done,2,,62,"7,302,737","10,621,836",5/14/2007,84,"alt rock, alternative metal, alternative rock, metal, nu metal, rap metal, rap rock, rock",1965224
4386,Morgan Wallen,Ain’t That Some,1,,81,"10,606,907","10,606,907",3/3/2023,75,"country, country pop",89032
4387,Big Sean,Go Legend (& Metro Boomin),2,,84,"6,327,785","10,606,250",12/8/2017,50,"hip hop, kpop",116437
4388,TWICE,FANCY,2,,121,"5,870,284","10,605,793",4/22/2019,74,"3rd gen k-pop, dance, dance-pop, electronica, female vocals, girl group, j-pop, k-pop, korean, pop, r&b",806293
4389,JVKE,Angel Pt. 2,1,,88,"10,597,956","10,597,956",6/15/2023,61,"alternative pop, indie pop, pop",22228
4390,Anderson .Paak,Tints,1,,121,"5,600,121","5,600,121",2/8/2024,42,"alternative, alternative hip hop, alternative r&b, contemporary r&b, hip hop, indie r&b, r&b, soul",2264
4391,Selena Gomez,999,1,,180,"5,599,395","5,599,395",5/26/2025,20,"2010s, 2020s, alternative pop, alternative r&b, art pop, brostep, contemporary r&b, dance-pop, electro house, electro-disco, electropop, english, pop, rock, spanish, teen pop",1754
4392,Loredana,Genick,1,,134,"5,597,608","5,597,608",9/13/2019,46,"german, hip hop, rap",8274
4393,Salmo,CABRIOLET,1,,130,"5,587,509","5,587,509",11/11/2023,6,"hardcore hip hop, hip hop, rap",516
4394,Sia,Floating Through Space,1,,152,"5,579,697","5,579,697",3/1/2024,71,"alternative pop, art pop, australian, dance-pop, electropop, indie pop, pop",83834
4395,Bazzi,Young & Alive,1,,167,"5,578,323","5,578,323",9/16/2022,57,pop,138428
4396,Fivio Foreign,Paris to Tokyo,1,,198,"5,572,362","5,572,362",7/8/2022,49,"drill, east coast hip hop, hip hop",105928
4397,Chris Brown,Fine By Me,3,,138,"1,990,795","5,568,842",12/18/2015,48,"2000s, 2010s, contemporary r&b, dance, electro house, electropop, hip hop, pop, r&b, trap",37379
4398,BTS,Paradise,1,,114,"5,560,683","5,560,683",10/24/2011,84,"2010s, 2020s, boy group, english, k-pop, pop",378952
4399,Future,Worst Day,1,,192,"5,557,686","5,557,686",2/11/2022,48,"english, hip hop, southern hip hop, trap, trap rap",140739
4400,Lil Wayne,I Love You Dwayne,1,,127,"5,553,668","5,553,668",9/28/2018,38,"2000s, 2010s, criminal, gangsta rap, hip hop, pop, pop rap, r&b, rap rock, rock, southern hip hop, trap",59463
4401,Capital Bra,Komm Komm,1,,123,"5,552,890","5,552,890",5/21/2020,39,"berlin, german, hip hop, pop rap, rap, trap",7402
4402,Jin,Yours,1,,165,"5,552,211","5,552,211",5/12/2020,62,"k-pop, pop",239542
4403,Internet Money,Lemonade (Feat. Roddy Ricch & Don Toliver) [Remix],1,,153,"5,550,390","5,550,390",10/30/2020,24,"emo rap, hip hop, trap",42634
4404,Shawn Mendes,Don't Be A Fool,2,,130,"2,913,268","5,549,708",4/20/2017,54,"2010s, 2020s, english, folk pop, pop, pop rock, pop soul, teen pop",118693
4405,Joji,Tick Tock,1,,145,"5,547,939","5,547,939",9/24/2020,58,"alt-pop, alternative r&b, art pop, ballad, instrumental hip hop, lo-fi hip hop, r&b/soul, trip hop",280571
4406,GAYLE,abcdefu (angrier),1,,192,"5,544,011","5,544,011",9/24/2021,64,"alternative pop, alternative rock, alternative/indie rock, emo pop, emo-pop, pop, pop punk, pop rock, power pop",202662
4407,Lil Wayne,Mess,1,,128,"5,543,367","5,543,367",5/8/2025,81,"2000s, 2010s, criminal, gangsta rap, hip hop, pop, pop rap, r&b, rap rock, rock, southern hip hop, trap",65121
4408,The Chainsmokers,Bloodstream,1,,83,"5,543,260","5,543,260",12/7/2016,27,"2010s, dance-pop, edm, electro house, electronic, electropop, future bass, satire",60599
4409,Huncho Jack,Eye 2 Eye,1,,120,"5,542,140","5,542,140",12/21/2017,53,"hip hop, kpop",127736
4410,Future,Over Your Head,1,,149,"5,534,361","5,534,361",11/13/2020,47,"english, hip hop, southern hip hop, trap, trap rap",116852
4411,H.E.R.,Come Through,1,,150,"5,531,998","5,531,998",3/27/2025,52,"alternative r&b, r&b, trap",1053
4412,Frank Ocean,DHL,1,,129,"5,531,463","5,531,463",10/19/2019,60,"alternative r&b, contemporary r&b, pop, queer, r&b, rnb, server name",507955
4413,Doja Cat,Naked,1,,165,"5,527,865","5,527,865",1/30/2023,30,"alternative rock, grunge, hip hop, nuno, pop, pop rap, post-grunge, power pop, rap, rock, trap, west coast hip hop",479685
4414,Stromae,Santé,1,,174,"5,526,277","5,526,277",7/30/1996,80,"art pop, dance-pop, electro house, electropop, french pop, hip house",187539
4415,Justin Timberlake,Man of the Woods,1,,115,"5,517,667","5,517,667",2/2/2018,69,"2000s, boogie, contemporary r&b, dance-pop, disco, electropop, neo soul, pop, r&b, synth funk",57550
4416,21 Savage,asmr,1,,177,"5,516,007","5,516,007",2/16/2022,36,"gangsta rap, hip hop, mumble rap, pop rap, southern hip hop, trap",204723
4417,Pusha T,If You Know You Know,1,,116,"5,513,542","5,513,542",3/24/2023,80,"boom bap, east coast hip hop, gangsta rap, hardcore hip hop, hip hop, southern hip hop, trap rap",327838
4418,BTS,Heartbeat (BTS World Original Soundtrack),1,,137,"5,512,091","5,512,091",6/28/2019,63,"2010s, 2020s, boy group, english, k-pop, pop",272034
4419,Madame,VOCE,1,,158,"5,510,906","5,510,906",5/30/2025,60,"alternative r&b, art pop, electronic, european rap, hip hop, italian hip-hop, italian pop, italian rap, italian trap, nuno, pop, pop rap, trap",19183
4420,XXXTENTACION,vice city,1,,181,"5,507,522","5,507,522",1/28/2022,68,"death by murder, emo rap, hip hop, rap, southern hip hop, trap, trap metal",336146
4421,Future,GOLD STACKS,1,,190,"5,505,266","5,505,266",5/2/2022,45,"english, hip hop, southern hip hop, trap, trap rap",153620
4422,Sfera Ebbasta,Tik Tok,1,,162,"5,504,912","5,504,912",8/7/2009,54,"hip hop, italian, rap, trap",99
4423,A Boogie Wit da Hoodie,Might Not Give Up,1,,160,"5,503,902","5,503,902",2/14/2020,46,"2010s, 2020s, emo rap, english, hip hop, r&b, rap, trap",244
4424,Kendrick Lamar,Alright,2,,87,"3,776,249","5,500,328",3/16/2015,79,"2010s, 2020s, alternative hip hop, conscious hip hop, hardcore hip hop, hip hop, jazz rap, pop, pop rap, rap, trap, west coast hip hop",1752037
4425,XXXTENTACION,Ex Bitch,1,,178,"5,500,157","5,500,157",12/6/2019,67,"death by murder, emo rap, hip hop, rap, southern hip hop, trap, trap metal",268798
4426,Lil Uzi Vert,Leaders,1,,147,"5,496,780","5,496,780",3/13/2020,53,"hip hop, kpop",947
4427,Bad Bunny,Si Estuviésemos Juntos,1,,197,"5,496,274","5,496,274",12/23/2018,78,"hip hop, latin, latin trap, reggaeton, trap latino",231393
