Id,Artist,Title,Wks,T10,PK,Pkstreams,Total,ReleaseDate,Popularity,Genre,Unique_Listener
1310,Bella Poarch,Build a Bitch,16,,20,"19,087,081","199,535,779",5/14/2021,68,"dark pop, pop",379000
1311,Bad Bunny,Si Veo a Tu Mamá,19,2,7,"26,149,940","199,237,634",2/29/2020,78,"hip hop, latin, latin trap, reggaeton, trap latino",296781
1312,Daddy Yankee,La Rompe Corazones,38,,73,"6,121,850","199,142,951",1/13/2017,71,"hip hop, latin, latin pop, latin urban, puerto rico, reggae, reggaeton",101122
1313,Nio Garcia,AM,15,,13,"19,361,444","198,837,542",8/21/2015,48,"latin, latin urban, reggaeton, trap latino",53878
1314,Juice WRLD,Righteous,22,1,10,"23,233,286","198,789,768",3/29/2022,60,"2020s, cloud rap, emo rap, hip hop, look again, rap, trap",391437
1315,AURORA,Runaway,21,,19,"17,843,306","198,554,137",3/11/2016,77,"afro house, alternative dance, alternative music, alternative/indie rock, art pop, bass house, chamber pop, dance, dance-pop, dark pop, deep house, disco, dj tools, dream pop, edm, electronica, electropop, folk pop, folktronica, house, indie pop, indie rock, indietronica, left-field pop, nordic folk music, norway, norwegian, norwegian pop, organic house, pop, synth-pop, synthpop, tech house, techno, trance, ポップ",922376
1316,Bad Bunny,Andrea,20,,21,"20,944,879","198,359,825",10/30/1998,61,"hip hop, latin, latin trap, reggaeton, trap latino",231898
1317,Bad Bunny,Dos Mil 16,22,,19,"22,964,487","198,214,582",5/6/2022,77,"hip hop, latin, latin trap, reggaeton, trap latino",225174
1318,Sam Smith,Too Good At Goodbyes - Edit,8,8,1,"30,706,135","197,619,743",11/3/2017,82,"alliteration, alternative r&b, blue-eyed soul, english, lgbtqi, nuno, pop, pop soul, queer, soul, synth funk",32327
1319,Tainy,Agua,20,,19,"14,876,852","197,532,423",9/13/2023,57,"english, latin, latin urban, reggaeton, spanish",1497
1320,Billie Eilish,all the good girls go to hell,30,,11,"21,263,958","197,126,834",3/29/2019,72,"2010s, 2020s, alt-pop, alternative pop, alternative r&b, art pop, bedroom pop, contemporary r&b, dark pop, electronic, electronica, electropop, gen z, indie pop, nepo baby, pity pop, pop, pop rock, pop soul, queer, singer-songwriter",950678
1321,Baby Keem,family ties,26,,30,"14,079,036","196,990,310",9/10/2021,78,"hip hop, trap, west coast hip hop",26609
1322,Kali Uchis,Igual Que Un Ángel,11,,11,"27,913,857","196,973,231",1/12/2024,77,"alternative r&b, contemporary r&b, latin pop, neo soul",7618
1323,Selena Gomez,Kill Em With Kindness,29,,22,"12,791,228","196,959,381",10/9/2015,62,"2010s, 2020s, alternative pop, alternative r&b, art pop, brostep, contemporary r&b, dance-pop, electro house, electro-disco, electropop, english, pop, rock, spanish, teen pop",428662
1324,JHAYCO,Ley Seca,26,,44,"11,418,146","196,956,035",9/3/2021,71,"latin, merengue, salsa",61872
1325,LISA,Rockstar,12,,14,"30,595,146","196,924,219",6/27/2024,74,"2020s, 3rd gen k-pop, dance-pop, electropop, hip hop, k-pop, pop, pop rap, t-pop, thai",540956
1326,Deorro,Five More Hours - Deorro x Chris Brown,51,,17,"7,687,290","196,912,591",4/20/2015,1,"big room house, edm, electro house, house, latin house, melbourne bounce",191509
1327,Anuel AA,Hasta Que Dios Diga,25,,32,"12,049,486","196,105,647",5/29/2020,79,"latin, reggaeton, trap latino",150482
1328,Radiohead,Let Down,17,,55,"13,687,336","208,561,417",5/28/1997,89,"alternative, alternative rock, alternative rock music, art pop, art rock, british, electronic, electronica, experimental, experimental rock, indie rock, post-britpop, progressive rock music, rock",2223807
1329,Keala Settle,This Is Me,29,,30,"12,318,355","195,715,437",12/8/2017,72,"rap, love, romatic",340130
1330,Taylor Swift,Snow On The Beach,10,2,3,"57,484,297","195,711,243",5/26/2023,74,"2000s, 2010s, 2020s, alternative pop, artist of the decade, contemporary country, 
country, country pop, cultural icon, electropop, female vocals, icon, indie folk, late 2000s, millennial, 
nuno, pop, pop rock, re-recording, singer-songwriter, singer/songwriter, synth-pop, love",16038
1331,Troye Sivan,YOUTH,42,,35,"7,728,959","195,444,169",10/31/2015,43,"dream-pop, electropop, pop, queer, synth-pop, synthpop",671409
1332,Piso 21,Me Llamas,45,,87,"5,308,014","195,407,150",5/11/2018,62,"latin, latin pop, reggaeton",21753
1333,Alessia Cara,Here,46,,21,"7,816,018","195,246,905",4/30/2021,72,"2010s, 2020s, adult alternative, alternative r&b, contemporary r&b, lyricist, musician, pop, pop rock, pop soul, r&b, soul, vocalist",724390
1334,Major Lazer,Know No Better,22,,31,"12,632,455","194,970,453",3/26/2021,52,"art pop, dance-pop, dancehall, edm, electronic, electropop, jungle terror, moombahton, pop reggae",111461
1335,Ozuna,Despeinada,25,,37,"11,981,239","194,897,155",9/4/2020,74,"latin, latin trap, latin urban, reggaeton, trap latino",43671
1336,Avicii,Hey Brother,60,24,2,"13,532,381","194,753,156",9/16/2013,79,"dance-pop, edm, electro house, electronic, electropop, festival progressive house, funky house, house, progressive house, tropical house",937144
1337,OMI,Cheerleader - Felix Jaehn Remix Radio Edit,49,,14,"8,657,981","194,611,409",10/16/2015,80,"afrobeats, dance-pop, pop reggae, reggae-pop, tropical house",639142
1338,BLACKPINK,Kill This Love,21,1,5,"25,341,137","194,512,702",4/5/2019,71,"2010s, 2020s, 3rd gen k-pop, female vocals, girl crush, girl group, hip hop, k-pop, pop",780876
1339,Tate McRae,she's all i wanna be,24,,38,"11,010,991","194,438,124",5/27/2022,80,"2020s, alternative pop, contemporary r&b, dance-pop, female vocals, pop, pop rock",511539
1340,Daya,Hide Away,44,,33,"8,959,707","194,389,867",5/10/2024,54,"electropop, pop, synthpop",352955
1341,Ovy On The Drums,YO y TÚ,15,,34,"14,795,532","206,689,272",6/11/2025,90,"latin, reggaeton",48207
1342,James Arthur,Train Wreck,28,,62,"8,633,301","194,286,285",10/28/2016,79,"pop, pop soul",392995
1343,Travis Scott,MELTDOWN,13,2,3,"38,029,412","193,987,336",2008,54,"english, experimental hip hop, hip hop, pop rap, rap, southern hip hop, trap",297698
1344,Alex Sensation,Que Va,32,,54,"8,180,443","193,835,148",9/20/2024,83,"2010s, 2020s, bachata, dancehall, latin, latin urban, reggaeton",47114
1345,King,Maan Meri Jaan,17,,40,"14,443,508","193,790,951",9/13/2022,70,"asian, death by covid-19, desi, filmi, filmi sangeet, indian, lata-mangeshkar",42159
1346,AC/DC,Highway to Hell,24,,149,"9,752,965","193,781,695",7/27/1979,85,"blues rock, classic rock, hard & heavy, hard rock, rock, rock and roll",1990576
1347,Gucci Mane,I Get The Bag,32,,45,"9,649,817","193,348,876",10/13/2017,71,"criminal, hip hop, southern hip hop, trap",2751
1348,Sabrina Carpenter,Busy Woman,15,,25,"22,886,771","193,178,832",2/14/2025,83,"2020s, dance-pop, electropop, pop",733117
1349,Fuerza Regida,NEL,15,,52,"14,587,712","192,998,036",6/25/2002,80,regional mexicano,72267
1350,Zac Efron,Rewrite The Stars,27,,20,"13,767,744","192,824,494",12/8/2017,72,"rap, love, romatic",513678
1351,Billie Eilish,i love you,33,,21,"15,560,959","192,755,769",11/28/2014,87,"2010s, 2020s, alt-pop, alternative pop, alternative r&b, art pop, bedroom pop, contemporary r&b, dark pop, electronic, electronica, electropop, gen z, indie pop, nepo baby, pity pop, pop, pop rock, pop soul, queer, singer-songwriter",1137785
1352,Bad Bunny,A Tu Merced,28,,52,"11,349,696","192,725,631",2/29/2020,75,"hip hop, latin, latin trap, reggaeton, trap latino",220056
1353,Daddy Yankee,X ÚLTIMA VEZ,20,,18,"14,423,132","192,384,737",3/25/2022,66,"hip hop, latin, latin pop, latin urban, puerto rico, reggae, reggaeton",118717
1354,wifiskeleton,Nope your too late i already died,20,,74,"11,324,503","200,059,835",10/22/2024,88,"emo rap, hyperpop, sigilkore, trap",511909
1355,Famous Dex,PICK IT UP,33,,60,"7,738,660","191,727,347",9/19/2025,74,"hip hop, trap",2451
1356,Camila Cabello,Crying in the Club,24,,33,"12,362,727","191,612,776",5/18/2017,67,"dance-pop, electropop, hyperpop, latin pop, pop, r&b",386648
1357,Sam Smith,Have Yourself A Merry Little Christmas,30,,29,"14,168,829","191,023,771",1957-09,62,"alliteration, alternative r&b, blue-eyed soul, english, lgbtqi, nuno, pop, pop soul, queer, soul, synth funk",370361
1358,"Tyler, The Creator",EARFQUAKE,21,2,6,"22,055,401","190,835,911",5/17/2019,79,"hardcore hip hop, hip hop, horrorcore, west coast hip hop",1947451
1359,The Weeknd,After Hours,18,2,7,"27,647,920","190,801,151",3/20/2020,82,"2010s, 2020s, alternative r&b, contemporary r&b, dance-pop, hypnagogic pop, pop, r&b, synth-pop",1109365
1360,Chris Jedi,La Llevo Al Cielo (Ft. Ñengo Flow),21,,53,"10,315,352","190,680,964",5/20/2022,71,"latin, latin urban, reggaeton",79205
1361,Megan Thee Stallion,Savage,20,,16,"16,972,890","190,528,290",6/11/2020,71,"english, hip hop, pop rap, rap, southern hip hop, trap",458507
1362,David Guetta,Like I Do,23,,24,"13,691,658","190,243,313",3/4/2022,66,"dance, dance-pop, electro house, electronic, electropop, english, festival progressive house, future rave, house, tech house",193921
1363,Milky Chance,Stolen Dance,64,,11,"5,886,704","190,227,561",5/31/2013,79,"rap, love, romatic",1265172
1364,Sia,The Greatest,20,6,5,"21,392,605","188,130,736",10/21/2016,76,"alternative pop, art pop, australian, dance-pop, electropop, indie pop, pop",466280
1365,Rauw Alejandro,Tattoo,24,,42,"10,234,460","189,842,710",2/25/2023,80,"hip hop, latin, latin urban, reggaeton, trap latino",54031
1366,Kendrick Lamar,LOYALTY. FEAT. RIHANNA.,29,1,8,"22,546,126","189,761,778",4/14/2017,75,"2010s, 2020s, alternative hip hop, conscious hip hop, hardcore hip hop, hip hop, jazz rap, pop, pop rap, rap, trap, west coast hip hop",1210881
1367,Migos,T-Shirt,36,,39,"9,681,183","189,520,094",1/27/2017,67,"hip hop, southern hip hop, trap",365150
1368,Snakehips,All My Friends,39,,32,"7,648,380","189,493,855",12/22/2017,29,"rap, love, romatic",136723
1369,Zara Larsson,Ruin My Life,23,,28,"12,387,820","189,409,768",10/1/2025,65,"alternative pop, contemporary r&b, dance-pop, electropop, pop, synth-pop",333640
1370,YNW Melly,Suicidal,21,,23,"14,973,919","189,223,292",9/13/2024,37,"hip hop, pop rap, southern hip hop, trap",307142
1371,Bad Bunny,Yo No Soy Celoso,18,,11,"26,785,831","188,902,577",5/6/2022,76,"hip hop, latin, latin trap, reggaeton, trap latino",287340
1372,Major Lazer,Run Up,21,,17,"13,789,550","188,477,960",9/16/1985,81,"art pop, dance-pop, dancehall, edm, electronic, electropop, jungle terror, moombahton, pop reggae",73481
1373,Sia,The Greatest,14,5,5,"20,550,436","188,130,736",10/21/2016,76,"alternative pop, art pop, australian, dance-pop, electropop, indie pop, pop",466280
1374,Tanishk Bagchi,"Saiyaara (From ""Saiyaara"")",10,2,6,"30,371,053","199,637,762",6/3/2025,88,filmi,22162
1375,ThxSoMch,SPIT IN MY FACE!,21,,67,"11,730,038","188,045,488",12/20/2022,78,post-punk revival,695129
1376,French Montana,No Stylist,25,,27,"12,894,471","188,011,040",9/20/2018,58,"east coast hip hop, hip hop",82572
1377,Bad Bunny,Dakiti,4,4,1,"53,029,262","187,932,142",10/30/2020,78,"hip hop, latin, latin trap, reggaeton, trap latino",4669
1378,Travis Scott,STARGAZING,22,1,3,"30,434,014","187,923,787",5/10/2024,85,"english, experimental hip hop, hip hop, pop rap, rap, southern hip hop, trap",786124
1379,Zion & Lennox,Yo Voy,26,,59,"8,660,824","187,846,448",5/4/2004,78,"latin, latin urban, reggaeton, urbano latino",9288
1380,Neton Vega,M&M,17,,60,"13,856,793","187,788,183",2/15/2000,64,"corrido tumbado, regional mexicano",47804
1381,Marc Seguí,Tiroteo - Remix,24,,48,"10,213,958","187,222,211",4/1/2021,82,"rap, love, romatic",150884
1382,Aya Nakamura,Djadja,22,,36,"12,255,568","187,083,954",11/2/2018,70,"afrobeats, alternative r&b, r&b",185301
1383,Rochy RD,Ella No Es Tuya - Remix,19,,23,"15,037,831","186,980,119",2/3/2021,66,latin,55126
1384,Frank Sinatra,Jingle Bells - Remastered 1999,17,,38,"22,363,093","186,667,778",1957-09,52,"acting, actors, big band, christmas, christmas music, easy listening, jazz, lounge, motion picture producers and directors, motion pictures--production and direction, pop, singers, singing, standards, swing, traditional pop, ultimate, vocal, vocal jazz",360718
1385,JISOO,FLOWER,13,1,10,"25,336,731","186,663,568",8/18/2023,85,"2020s, 3rd gen k-pop, k-pop",373367
1386,HVME,Goosebumps,24,,33,"12,635,535","186,021,054",9/16/2016,84,"dance, deep house, english, future house, house, slap house",187814
1387,Pink Sweat$,At My Worst,28,,71,"8,197,478","186,001,444",7/17/2020,67,"rap, love, romatic",316306
1388,Ed Sheeran,Cross Me,16,1,9,"19,742,322","185,780,568",12/20/2018,67,"dance-pop, folk, folk pop, guitarist, music for soccer moms, persian pop, pop, singer, singer-songwriter, soft rock, uk",2993
1389,Sebastian Yatra,Traicionera,47,,68,"5,324,707","185,664,428",5/18/2018,74,"latin, latin pop, latin urban, reggaeton",114345
1390,JHAYCO,Holanda,15,,29,"15,957,352","185,419,364",7/28/2023,68,"hip hop, reggaeton, trap latino",113473
1391,Pop Smoke,Hello,31,,88,"7,327,301","185,351,007",5/17/2024,32,visual kei,4127
1392,Taylor Swift,Who’s Afraid of Little Old Me?,10,,12,"49,947,775","185,345,918",4/19/2024,71,"2000s, 2010s, 2020s, alternative pop, artist of the decade, contemporary country, 
country, country pop, cultural icon, electropop, female vocals, icon, indie folk, late 2000s, millennial, 
nuno, pop, pop rock, re-recording, singer-songwriter, singer/songwriter, synth-pop, love",578728
1393,Justin Timberlake,Say Something,20,,25,"12,836,798","185,134,955",1/20/2014,71,"2000s, boogie, contemporary r&b, dance-pop, disco, electropop, neo soul, pop, r&b, synth funk",125762
1394,Lil Durk,All My Life,15,,17,"18,736,659","184,952,632",5/12/2023,69,"chicago drill, drill, english, hip hop, pop rap, rap, trap",1868
1395,Bruno Mars,Smokin Out The Window,16,1,8,"24,621,720","184,842,709",11/12/2021,63,"funk, r&b, soul, supergroup",825383
1396,Jerry Di,Mi Cuarto,25,,47,"10,376,418","184,817,480",4/3/2020,69,"rap, love, romatic",60628
1397,Kodak Black,Tunnel Vision,31,,40,"10,718,629","184,805,957",3/31/2017,73,"hip hop, rap, southern hip hop, trap",501847
1398,Marshmello,One Thing Right,23,,30,"12,498,236","184,788,700",6/21/2019,72,"edm, english, future bass, hip hop, progressive house, trap edm",149112
1399,Fuerza Regida,TÚ NAME,16,,55,"14,582,203","184,520,122",2/9/2024,81,regional mexicano,98755
1400,Ed Sheeran,Eyes Closed,16,,27,"18,278,985","183,884,713",5/5/2023,73,"dance-pop, folk, folk pop, guitarist, music for soccer moms, persian pop, pop, singer, singer-songwriter, soft rock, uk",265825
1401,Kanye West,Praise God,24,,16,"19,702,684","183,588,773",8/29/2021,71,"chipmunk soul, christian hip hop, conscious hip hop, electropop, experimental hip hop, gospel, hip hop, nazi, pop, pop rap, pro trump, producer, progressive rap, trap",912973
1402,Marília Mendonça,Leão,17,,48,"14,419,764","182,957,139",6/1/2015,75,"sertanejo, sertanejo universitário",195707
1403,Alesso,Heroes (we could be),52,,11,"7,138,967","17,405,115",5/22/2015,73,"2010s, 2020s, big room house, dance-pop, edm, electro house, future bass, progressive house",543872
1404,Lauv,"fuck, i'm lonely",21,,30,"12,502,607","182,068,515",3/6/2020,62,"alternative pop, electropop, indie pop, pop, queer",93892
1405,LISA,Moonlit Floor,10,,13,"26,833,108","181,884,374",10/3/2024,71,"2020s, 3rd gen k-pop, dance-pop, electropop, hip hop, k-pop, pop, pop rap, t-pop, thai",138671
1406,Rauw Alejandro,PUNTO 40,18,,48,"12,774,461","181,762,348",1/24/2023,69,"hip hop, latin, latin urban, reggaeton, trap latino",155285
1407,Sia,Thunderclouds,25,,34,"12,055,103","181,529,908",4/12/2019,68,"rap, love, romatic",30648
1408,Sam Smith,Like I Can,51,,22,"9,813,362","181,479,984",5/26/2014,73,"alliteration, alternative r&b, blue-eyed soul, english, lgbtqi, nuno, pop, pop soul, queer, soul, synth funk",606123
1409,Tove Lo,Cool Girl,23,,26,"11,477,311","181,099,854",10/28/2016,61,"alternative pop, contemporary r&b, dance-pop, electropop, female vocals, indie pop, pop",390163
1410,Taylor Swift,"You're On Your Own, Kid",11,1,6,"50,484,259","181,095,035",10/21/2022,79,"2000s, 2010s, 2020s, alternative pop, artist of the decade, contemporary country, 
country, country pop, cultural icon, electropop, female vocals, icon, indie folk, late 2000s, millennial, 
nuno, pop, pop rock, re-recording, singer-songwriter, singer/songwriter, synth-pop, love",905362
1411,Sam Feldt,Post Malone,27,,59,"8,990,462","180,642,863",9/6/2019,76,"edm, english, house",2671
1412,Sky Rompiendo,El Cielo,15,,18,"18,445,619","180,518,419",6/2/2023,75,"latin, latin urban, reggaeton",113890
1413,SZA,Low,17,,29,"18,756,469","180,450,037",10/18/2023,61,"alternative r&b, american, contemporary r&b, electronic, hip hop soul, neo soul, pop, r&b",1080764
1414,Halsey,Graveyard,21,,31,"13,583,667","180,428,896",1/17/2020,63,"2010s, 2020s, alternative pop, alternative r&b, alternative rock, contemporary r&b, electropop, indie pop, pop, pop rock, queer, synth-pop",390143
1415,Jay Rock,King's Dead,24,,29,"12,530,784","180,344,827",1/12/2018,67,"hard rock, hardcore punk, japanese, speed metal, thrash metal",17548
1416,Bad Bunny,EL CLúB,11,,16,"29,567,438","180,096,596",1/5/2025,79,visual kei,324766
1417,Lizzy McAlpine,ceilings,15,,35,"16,006,302","179,527,000",4/8/2022,80,"folk pop, indie folk, indie pop, singer-songwriter",893690
1418,Tyla,PUSH 2 START,17,,61,"14,000,398","178,933,022",10/11/2024,81,"afrobeats, amapiano, contemporary r&b, pop, r&b",470650
1419,KATSEYE,Touch,18,,78,"12,599,970","188,022,997",7/26/2024,86,"dance-pop, female vocals, girl group, k-pop, pop",754801
1420,Creepy Nuts,Bling-Bang-Bang-Born,15,,57,"13,257,996","178,827,370",1/7/2024,75,"hip hop, jersey club rap, pop rap",336076
1421,Migos,MotorSport,25,,34,"10,910,672","178,670,224",1/26/2018,67,"hip hop, southern hip hop, trap",412975
1422,Flo Milli,Never Lose Me,13,,25,"18,555,581","178,548,654",11/30/2023,71,"hip hop, trap",734228
1423,DENNIS,Tá OK,15,,41,"14,645,353","177,960,206",5/4/2023,67,"rap, love, romatic",290763
1424,Kapo,Ohnana,14,,39,"16,417,164","177,468,726",5/16/2025,42,"afrobeats, latin, reggaeton",66758
1425,Kodak Black,Roll In Peace,36,,79,"6,161,080","177,159,883",8/18/2017,72,"hip hop, rap, southern hip hop, trap",3856
1426,J Balvin,Sigo Extrañándote,34,,72,"6,775,494","177,064,080",6/24/2016,72,"hip hop, latin, latin pop, pop, reggaeton",83676
1427,Hailee Steinfeld,Most Girls,30,,54,"8,555,977","176,918,299",4/28/2017,66,"dance-pop, electropop, nuno, synthpop",291435
1428,Alan Walker,On My Way,23,,39,"11,307,170","176,875,061",3/21/2019,73,"2010s, 2020s, dance, edm, electro house, electronic, electropop, future bass, pop, progressive house, tropical house",368882
1429,The Chainsmokers,Sick Boy,17,,14,"15,514,241","176,832,494",12/14/2018,63,"2010s, dance-pop, edm, electro house, electronic, electropop, future bass, satire",230972
1430,OneRepublic,Run,23,,56,"9,315,746","176,810,218",6/9/2025,55,"folk pop, pop, pop rock, rock",297391
1431,Anirudh Ravichander,Chaleya,14,,22,"17,534,302","176,777,944",9/5/2023,67,"composer, film composer, filmi",45197
1432,LE SSERAFIM,ANTIFRAGILE,19,,63,"10,481,962","176,681,948",10/17/2022,69,"4th gen k-pop, girl group, k-pop",772064
1433,ROSÉ,toxic till the end,14,,29,"22,405,419","176,590,715",12/6/2024,80,"2020s, 3rd gen k-pop, ballad, k-pop, korean ballad, pop",336319
1434,Kygo,Lose Somebody,23,,32,"12,493,331","176,218,722",5/29/2020,64,"folk pop, pop, pop rock, rock",211105
1435,David Guetta,Dangerous,38,12,2,"9,917,577","176,180,000",4/1/2016,80,"dance, dance-pop, electro house, electronic, electropop, english, festival progressive house, future rave, house, tech house",21263
1436,SZA,30 For 30,14,,32,"19,022,983","176,168,588",12/20/2024,78,"alternative r&b, american, contemporary r&b, electronic, hip hop soul, neo soul, pop, r&b",4450
1437,Drake,I'm Upset,17,1,7,"28,743,698","176,145,018",6/29/2018,64,"rap, love, romatic",358066
1438,Lizzo,Good As Hell,24,,29,"12,495,965","144,934,954",4/17/2019,69,"contemporary r&b, hip hop, pop rap, pop soul, r&b, rap",501240
1439,Charli xcx,360,15,,42,"15,835,399","176,087,409",6/7/2024,77,"2010s, 2020s, bubblegum bass, dance-pop, deconstructed club, electronic, electropop, europop, experimental hip hop, experimental pop, hyperpop, pc music, pop, synth-pop, uk",1483095
1440,Taylor Swift,"So Long, London",8,1,4,"61,238,184","175,554,911",4/18/2024,69,"2000s, 2010s, 2020s, alternative pop, artist of the decade, contemporary country, 
country, country pop, cultural icon, electropop, female vocals, icon, indie folk, late 2000s, millennial, 
nuno, pop, pop rock, re-recording, singer-songwriter, singer/songwriter, synth-pop, love",624552
1441,Drake,Portland,23,,13,"18,349,259","175,510,252",3/18/2017,68,"rap, love, romatic",516676
1442,Eminem,The Monster,54,18,1,"9,448,084","175,202,241",11/5/2013,81,"actor, boom bap, conscious hip hop, detroit, detroit hip hop, hardcore hip hop, hip hop, hip-hop, horrorcore, midwest hip hop, midwestern hip-hop, music trade, pop rap, rap, record producer, singer, songwriter, trap",989669
1443,Joel Corry,OUT OUT,22,,42,"10,741,703","175,190,741",8/13/2021,72,"dance, dj, edm, house, producer",1796
1444,Jon Bellion,All Time Low,25,,30,"11,324,808","175,004,521",6/10/2016,64,"hip hop, pop",478645
1445,Måneskin,ZITTI E BUONI,15,,12,"23,017,312","174,966,539",3/19/2021,72,"alternative rock, funk rock, glam rock, hard rock, pop rock, rock, rock and roll",500819
1446,BENNETT,Vois sur ton chemin - Techno Mix,19,,85,"10,409,940","174,733,850",8/4/2023,79,"rap, love, romatic",241729
1447,Bad Bunny,Me Fui de Vacaciones,17,,14,"25,735,690","174,257,702",5/6/2022,74,"hip hop, latin, latin trap, reggaeton, trap latino",210087
1448,Eminem,Till I Collapse,30,,81,"7,955,650","174,244,339",5/26/2002,83,"actor, boom bap, conscious hip hop, detroit, detroit hip hop, hardcore hip hop, hip hop, hip-hop, horrorcore, midwest hip hop, midwestern hip-hop, music trade, pop rap, rap, record producer, singer, songwriter, trap",758635
1449,Lil Xan,Betrayed,29,,55,"7,758,555","174,053,727",4/6/2018,65,"cloud rap, emo rap, trap, west coast hip hop",347738
1450,TINI,Cupido,16,,49,"13,527,144","173,894,630",11/3/2023,49,"latin, latin pop",107347
1451,Xavi,Corazón de Piedra,12,,21,"20,841,031","173,836,388",9/26/2025,2,"rap, love, romatic",67159
1452,Shakira,Clandestino,24,,39,"10,333,670","173,816,541",10/6/1998,65,"latin, latin pop, pop, pop rock",136057
1453,Israel & Rodolffo,Bombonzinho - Ao Vivo,21,,80,"9,615,391","173,811,718",11/3/2022,61,"rap, love, romatic",87874
1454,JP Cooper,September Song,35,,53,"8,421,372","173,520,421",10/6/2017,67,"funk, pop, soul",222402
1455,Rihanna,Love On The Brain,39,,68,"11,766,367","173,245,305",1/28/2016,85,"barbadian, contemporary r&b, dance, dance-pop, dancehall, electro house, electropop, female vocal, hip hop, influential pop star, pop, pop culture, pop soul, pop star, r&b, reggae",1337960
1456,Alessia Cara,Wild Things,30,,34,"8,564,900","172,829,488",11/13/2015,65,"2010s, 2020s, adult alternative, alternative r&b, contemporary r&b, lyricist, musician, pop, pop rock, pop soul, r&b, soul, vocalist",288695
1457,XXXTENTACION,the remedy for a broken heart (why am I so in love),29,,27,"13,521,112","172,520,068",3/16/2018,72,"death by murder, emo rap, hip hop, rap, southern hip hop, trap, trap metal",547299
1458,Camila Cabello,Don't Go Yet,18,,32,"13,205,250","172,420,222",7/23/2021,66,"dance-pop, electropop, hyperpop, latin pop, pop, r&b",323451
1459,Megan Thee Stallion,Sweetest Pie,23,,17,"14,634,331","172,096,336",3/11/2022,66,"english, hip hop, pop rap, rap, southern hip hop, trap",628168
1460,Luis Fonsi,Imposible,24,,59,"8,466,082","171,979,092",2/1/2019,63,"latin, latin pop, pop",55391
1461,Jonas Brothers,What A Man Gotta Do,21,,27,"15,362,782","171,914,353",1/17/2020,70,"pop rock, teen pop",235573
1462,Lil Mosey,Noticed,28,,41,"10,196,053","171,874,143",5/31/2024,90,"pop rap, trap",327414
1463,Rag'n'Bone Man,Human,36,,53,"6,934,906","171,869,921",2/10/2017,78,"blues, neo soul, pop soul, r&b, soul, uk",628485
1464,Cardi B,Money,24,,46,"9,714,415","171,754,414",2012,80,"alternative pop, east coast hip hop, hardcore hip hop, hip hop, pop, pop rap, queer, trap, trap soul",484357
1465,KAROL G,GATÚBELA,17,,33,"13,620,968","171,667,433",2/24/2023,66,"latin, latin urban, r&b, reggaeton, spanish",132466
1466,Nathan Evans,Wellerman - 220 KID x Billen Ted Remix,19,,31,"12,563,140","171,450,449",1/21/2021,66,"folk, pop",7
1467,Daryl Hall & John Oates,Jingle Bell Rock - Daryl's Version,20,,44,"14,476,755","171,218,186",11/1/1983,50,"blue-eyed soul, new wave, pop, pop rock, pop soul, soft rock",337813
1468,BØRNS,Electric Love,32,,61,"8,462,692","170,923,648",10/16/2015,80,"rap, love, romatic",1210277
1469,Meghan Trainor,NO,27,,19,"12,512,265","170,919,587",8/22/2025,60,"2010s, blue-eyed soul, bubblegum pop, dance-pop, doo-wop, music for soccer moms, pop, r&b, soul",553110
1470,Justin Bieber,Company,49,,19,"9,266,436","170,761,923",11/13/2015,78,"2010s, 2020s, dance-pop, pop, pop rap, r&b, teen pop",652510
1471,Kanye West,Famous,38,,17,"12,718,673","170,684,091",6/23/2025,76,"chipmunk soul, christian hip hop, conscious hip hop, electropop, experimental hip hop, gospel, hip hop, nazi, pop, pop rap, pro trump, producer, progressive rap, trap",1025080
1472,Bizarrap,"Tiago PZK: Bzrp Music Sessions, Vol. 48",24,,37,"10,685,239","170,468,423",12/29/2021,67,"pop, trap, trap edm, trap latino",101390
1473,Empire Of The Sun,We Are The People,18,,94,"10,899,202","170,380,287",10/3/2008,86,"dance-pop, electronic, electropop, indietronica, synthpop",1422899
1474,A Boogie Wit da Hoodie,Drowning,36,,90,"5,739,379","170,227,822",4/26/2023,65,"2010s, 2020s, emo rap, english, hip hop, r&b, rap, trap",5687
1475,Marc E. Bassy,You & Me,27,,34,"9,817,798","170,199,540",6/23/2010,43,"rap, love, romatic",148348
1476,Calvin Harris,Blessings,18,,105,"10,798,608","169,924,961",6/11/2021,61,"2010s, dance-pop, edm, electro house, electronic, electropop, festival progressive house, funktronica, late 2000s, nu disco, nu-disco, progressive house, uk hip hop",174882
