Id,Artist,Title,Wks,T10,PK,Pkstreams,Total,ReleaseDate,Popularity,Genre,Unique_Listener
2766,Zach Bryan,28,5,,59,"13,429,651","58,065,091",12/17/2021,5,"alternative country, americana, country, red dirt",224394
2767,Arijit Singh,"Apna Bana Le (From ""Bhediya"")",6,,80,"10,478,565","58,053,193",11/5/2022,23,"bollywood, filmi, gaana, indian pop",6230
2768,Anuel AA,Reggaetonera,11,,111,"6,571,017","58,014,315",5/29/2020,61,"latin, reggaeton, trap latino",37896
2769,Polo G,Go Stupid,10,,105,"7,492,896","57,980,699",5/15/2020,71,"chicago drill, drill, gangsta rap, hip hop, trap",359157
2770,KAROL G,SEJODIOTO,9,,78,"7,677,407","57,942,533",9/21/2021,67,"latin, latin urban, r&b, reggaeton, spanish",90604
2771,Jason Derulo,Try Me,28,,56,"3,276,609","57,935,087",3/30/2018,70,"2010s, 2020s, dance, deep house, edm, electro house, electronic, future bass, progressive house, tech house, tropical house",1544
2772,Shawn Mendes,Youth feat. Khalid,7,,21,"13,833,047","57,906,518",5/25/2018,63,"2010s, 2020s, english, folk pop, pop, pop rock, pop soul, teen pop",32339
2773,PSY,That That (prod. & feat. SUGA of BTS),6,,21,"15,109,107","57,882,567",4/29/2022,69,"alternative r&b, contemporary r&b, hardcore hip hop, hip hop, hip-hop, pop, pop rap, r&b, trap, trap rap",270463
2774,Manuel Turizo,Te Quemaste,11,,120,"5,712,670","57,868,175",8/23/2019,63,"latin, latin pop, latin urban, reggaeton",35502
2775,The Weeknd,Wasted Times,5,1,8,"21,345,197","57,740,424",3/30/2018,67,"2010s, 2020s, alternative r&b, contemporary r&b, dance-pop, hypnagogic pop, pop, r&b, synth-pop",480432
2776,Terror Jr,Come First,15,,70,"4,693,474","57,718,889",10/21/2016,40,"electropop, indie pop",64567
2777,Maluma,El Perdedor,21,,83,"3,827,361","57,713,407",10/30/2015,79,"english, latin, latin pop, latin urban, reggaeton, spanish, trap latino",200823
2778,Nicky Jam,Fan de Tus Fotos,11,,164,"5,617,068","57,649,659",2/8/2021,58,"latin, latin urban, reggaeton",22962
2779,Idina Menzel,Let It Go,32,,23,"3,221,607","57,463,945",1/1/2013,76,"musical, pop",231229
2780,Travis Scott,4X4,4,,19,"22,776,370","57,414,036",1/24/2025,74,"english, experimental hip hop, hip hop, pop rap, rap, southern hip hop, trap",356462
2781,Kanye West,Yikes,6,1,5,"23,601,268","57,386,445",2/7/2020,59,"chipmunk soul, christian hip hop, conscious hip hop, electropop, experimental hip hop, gospel, hip hop, nazi, pop, pop rap, pro trump, producer, progressive rap, trap",606652
2782,Bizarrap,"Paulo Londra: Bzrp Music Sessions, Vol. 23",5,,14,"16,849,977","57,352,830",4/25/2022,62,"pop, trap, trap edm, trap latino",61402
2783,Nicki Minaj,The Night Is Still Young,26,,51,"3,874,944","57,325,419",12/12/2014,70,"2010s, east coast hip hop, electronic, hip hop, late 2000s, pop, pop rap, queen of rap, r&b",569197
2784,Meghan Trainor,I'll Be Home,9,,94,"14,064,455","57,301,968",12/5/2024,52,"2010s, blue-eyed soul, bubblegum pop, dance-pop, doo-wop, music for soccer moms, pop, r&b, soul",271752
2785,Alan Walker,Tired,14,,109,"4,889,838","57,284,211",12/7/2018,72,"2010s, 2020s, dance, edm, electro house, electronic, electropop, future bass, pop, progressive house, tropical house",112456
2786,Bizarrap,Entre las de 20,5,,63,"12,988,709","57,271,014",4/3/2024,62,"pop, trap, trap edm, trap latino",47440
2787,PinkPantheress,Illegal,6,,91,"10,761,641","57,270,327",5/9/2025,83,"2020s, alternative pop, bubblegum pop, dance-pop, drum and bass, future garage, jungle, pop, uk garage",808286
2788,Taylor Swift,The Prophecy,4,,36,"24,507,979","57,250,903",4/19/2024,75,"2000s, 2010s, 2020s, alternative pop, artist of the decade, contemporary country, 
country, country pop, cultural icon, electropop, female vocals, icon, indie folk, late 2000s, millennial, 
nuno, pop, pop rock, re-recording, singer-songwriter, singer/songwriter, synth-pop, love",449508
2789,Christian Nodal,Ya No Somos Ni Seremos,8,,37,"10,942,404","57,233,501",5/27/2022,77,"mariachi, ranchera, regional mexicano",61137
2790,Sachet-Parampara,"Raanjhan (From ""Do Patti"")",6,,95,"10,769,601","57,227,648",10/4/2024,81,"alternative r&b, contemporary r&b, hardcore hip hop, hip hop, hip-hop, pop, pop rap, r&b, trap, trap rap",22005
2791,Sabrina Carpenter,Sugar Talking,4,,13,"23,340,645","57,156,495",8/29/2025,88,"2020s, dance-pop, electropop, pop",464837
2792,Lunay,Soltera,10,,104,"6,523,998","56,988,833",9/25/2024,81,"latin, latin urban, reggaeton",33479
2793,Duki,Si Quieren Frontear,8,,67,"7,990,603","56,868,771",3/31/2022,61,trap latino,61899
2794,Lauv,The Other,14,,103,"4,803,349","56,864,916",8/26/2016,68,"alternative pop, electropop, indie pop, pop, queer",165379
2795,AnnenMayKantereit,Tom's Diner,8,,65,"8,288,971","56,831,770",6/28/2019,75,"cologne, german, indie, pop, rock",312326
2796,21 Savage,née-nah,4,,15,"21,526,019","56,685,340",1/12/2024,70,"gangsta rap, hip hop, mumble rap, pop rap, southern hip hop, trap",494062
2797,Taylor Swift,The Man,5,1,7,"22,211,263","56,646,615",7/14/2008,84,"2000s, 2010s, 2020s, alternative pop, artist of the decade, contemporary country, 
country, country pop, cultural icon, electropop, female vocals, icon, indie folk, late 2000s, millennial, 
nuno, pop, pop rock, re-recording, singer-songwriter, singer/songwriter, synth-pop, love",925761
2798,Aminé,REEL IT IN,11,,115,"5,973,369","56,520,732",8/15/2018,66,hip hop,728487
2799,benny blanco,Roses,10,,95,"6,367,254","56,518,706",6/16/2015,80,"english, pop",4454
2800,Eminem,Not Alike,6,,12,"19,832,972","56,508,253",8/31/2018,60,"actor, boom bap, conscious hip hop, detroit, detroit hip hop, hardcore hip hop, hip hop, hip-hop, horrorcore, midwest hip hop, midwestern hip-hop, music trade, pop rap, rap, record producer, singer, songwriter, trap",7945
2801,Maluma,Madrid,11,,119,"5,844,487","56,503,581",5/25/2014,55,"english, latin, latin pop, latin urban, reggaeton, spanish, trap latino",10857
2802,Daddy Yankee,Don Don,10,,92,"6,762,546","56,498,558",11/18/2024,35,"hip hop, latin, latin pop, latin urban, puerto rico, reggae, reggaeton",14371
2803,DG e Batidão Stronda,Mãe Solteira,5,,67,"14,513,030","56,203,078",3/3/2025,76,"alternative r&b, contemporary r&b, hardcore hip hop, hip hop, hip-hop, pop, pop rap, r&b, trap, trap rap",159819
2804,Matoma,Old Thing Back,21,,38,"4,742,578","56,171,539",2/17/2015,63,"edm, house, tropical house",434
2805,Hearts & Colors,Lighthouse - Andrelli Remix,13,,75,"5,381,572","56,153,155",11/11/2016,43,"alternative r&b, contemporary r&b, hardcore hip hop, hip hop, hip-hop, pop, pop rap, r&b, trap, trap rap",67298
2806,Little Mix,Secret Love Song,24,,123,"2,573,690","56,110,373",11/6/2015,77,"british, dance, dance-pop, feminists, get weird, girl band, girl group, girl-group, glory days, jade thirlwall, jesy nelson, kind, kindest, kweens, lm5, perrie edwards, philanthropist, pop, pop rap, queens, r&b, rca, richest, salute, singer/songwriter, standard group, supporter, teen pop",92075
2807,Lauv,Feelings,9,,81,"6,831,033","56,090,466",3/6/2020,66,"alternative pop, electropop, indie pop, pop, queer",216884
2808,Thalia,Desde Esa Noche,23,,134,"2,696,534","56,072,012",5/6/2016,66,"latin, latin pop",933
2809,Bad Bunny,HACIENDO QUE ME AMAS,7,,21,"18,064,154","56,055,500",11/27/2020,74,"hip hop, latin, latin trap, reggaeton, trap latino",124359
2810,IVE,ELEVEN,9,,103,"6,988,011","56,044,730",12/1/2021,68,"4th gen k-pop, girl group, k-pop",460352
2811,Daddy Yankee,PROBLEMA,10,,110,"6,663,554","56,039,608",10/6/2023,62,"hip hop, latin, latin pop, latin urban, puerto rico, reggae, reggaeton",34677
2812,Lil Skies,Red Roses,13,,133,"4,863,769","56,030,364",3/28/2025,29,"emo rap, hip hop, pop rap, trap",1870
2813,Sabrina Carpenter,Goodbye,4,,26,"20,296,751","55,827,684",6/30/2017,50,"2020s, dance-pop, electropop, pop",389563
2814,Maroon 5,This Summer,20,,36,"5,241,984","55,827,120",5/18/2015,37,"alternative r&b, contemporary r&b, hardcore hip hop, hip hop, hip-hop, pop, pop rap, r&b, trap, trap rap",141974
2815,Bad Bunny,Pero Ya No,6,,29,"16,283,183","55,816,677",2/29/2020,66,"hip hop, latin, latin trap, reggaeton, trap latino",147141
2816,Drake,Virginia Beach,4,,11,"27,862,822","55,774,392",10/6/2023,75,"alternative r&b, contemporary r&b, hardcore hip hop, hip hop, hip-hop, pop, pop rap, r&b, trap, trap rap",479293
2817,Taylor Swift,Clara Bow,3,,23,"32,571,347","55,728,973",4/19/2024,67,"2000s, 2010s, 2020s, alternative pop, artist of the decade, contemporary country, 
country, country pop, cultural icon, electropop, female vocals, icon, indie folk, late 2000s, millennial, 
nuno, pop, pop rock, re-recording, singer-songwriter, singer/songwriter, synth-pop, love",444316
2818,Piso 21,Pa' Olvidarme De Ella,11,,157,"5,461,249","55,719,775",3/18/2021,71,"latin, latin pop, reggaeton",62011
2819,Jax Jones,All Day And Night - Jax Jones & Martin Solveig Present Europa,10,,98,"6,797,675","55,719,059",3/28/2019,54,"edm, house",63763
2820,Eminem,Stan,10,,138,"6,121,019","55,664,123",1/8/2009,58,"actor, boom bap, conscious hip hop, detroit, detroit hip hop, hardcore hip hop, hip hop, hip-hop, horrorcore, midwest hip hop, midwestern hip-hop, music trade, pop rap, rap, record producer, singer, songwriter, trap",1537207
2821,21 Savage,Runnin,8,,24,"15,864,178","55,651,027",9/16/1985,81,"gangsta rap, hip hop, mumble rap, pop rap, southern hip hop, trap",802265
2822,Jung Kook,Never Let Go,4,,21,"24,041,560","55,562,921",8/22/2025,61,"edm, k-pop, pop, r&b",209124
2823,BANDIDO,"No Me Conocen (Remix) [con DUKI, Rei & Tiago PZK]",9,,103,"6,709,106","55,472,583",6/16/2021,62,"alternative r&b, contemporary r&b, hardcore hip hop, hip hop, hip-hop, pop, pop rap, r&b, trap, trap rap",39034
2824,Trueno,Mamichula - con Nicki Nicole,5,,63,"13,104,464","55,463,864",7/23/2020,74,trap latino,132276
2825,Quavo,WORKIN ME,11,,96,"6,321,234","55,445,848",10/12/2018,53,"hip hop, pop rap, trap",107346
2826,Beach Bunny,Cloud 9,9,,91,"6,857,414","55,400,598",9/21/2014,51,"alternative pop, indie pop, indie rock, pop, power pop",860541
2827,¥$,FUK SUMN,4,,17,"20,785,329","55,373,407",2/9/2024,70,"hip hop, hip house",458153
2828,Loren Allred,Never Enough,11,,92,"6,268,587","55,370,618",12/8/2017,74,"alternative r&b, contemporary r&b, hardcore hip hop, hip hop, hip-hop, pop, pop rap, r&b, trap, trap rap",349952
2829,Martin Garrix,Don't Look Down,21,,37,"5,144,583","55,328,994",3/17/2015,64,"big room house, dance-pop, edm, electro house, festival progressive house, tropical house",115265
2830,Wiz Khalifa,Hopeless Romantic,12,,87,"6,498,571","55,299,961",7/13/2018,65,"east coast hip hop, hip hop, pop rap",1009
2831,Tom Walker,Leave a Light On,14,,169,"4,148,414","55,275,847",10/13/2017,68,"indie pop, pop soul, singer-songwriter",268442
2832,Imagine Dragons,Warriors,24,,27,"4,355,464","55,240,159",5/11/2015,71,"alternative pop, alternative rock, electropop, indie pop, indietronica, nuno, pop, pop rock, rock",635333
2833,Idina Menzel,Into the Unknown,8,,56,"8,711,295","55,217,766",11/15/2019,73,"alternative r&b, contemporary r&b, hardcore hip hop, hip hop, hip-hop, pop, pop rap, r&b, trap, trap rap",406604
2834,6ix9ine,TIC TOC,6,1,10,"17,944,769","55,185,548",5/23/2025,25,"2010s, drill, east coast hip hop, hardcore hip hop, hip hop, trap",38123
2835,Michael Bublé,Jingle Bells,14,,33,"10,918,972","55,153,901",9/3/2012,38,"big band, canadian, crazy love, easy listening, easy listening soundtracks and musicals, jazz, jazz pop, music for soccer moms, pop, swing",20054
2836,Maroon 5,Nobody's Love,8,,65,"9,612,671","55,146,187",6/11/2021,62,"indie rock, rock and indie",129187
2837,Davi Kneip,sentaDONA (Remix) s2,8,,48,"9,211,193","55,135,520",3/17/2022,58,"alternative r&b, contemporary r&b, hardcore hip hop, hip hop, hip-hop, pop, pop rap, r&b, trap, trap rap",222261
2838,Madison Beer,Reckless,9,,85,"7,176,234","55,119,104",6/4/2021,71,"alternative pop, dance-pop, pop, singer-songwriter",505642
2839,MXZI,MONTAGEM XONADA,6,,121,"9,875,596","64,977,960",7/2/2025,88,"alternative r&b, contemporary r&b, hardcore hip hop, hip hop, hip-hop, pop, pop rap, r&b, trap, trap rap",94901
2840,Ziv Zaifman,A Million Dreams,11,,95,"6,104,009","55,082,314",12/8/2017,74,"alternative r&b, contemporary r&b, hardcore hip hop, hip hop, hip-hop, pop, pop rap, r&b, trap, trap rap",303631
2841,Halsey,Nightmare,6,,18,"15,621,619","54,948,923",7/25/2010,75,"2010s, 2020s, alternative pop, alternative r&b, alternative rock, contemporary r&b, electropop, indie pop, pop, pop rock, queer, synth-pop",384527
2842,Metro Boomin,10 Freaky Girls,8,,40,"10,438,741","54,930,937",11/6/2018,72,"hip hop, trap",7162
2843,Black Eyed Peas,I Gotta Feeling,7,,118,"8,503,727","54,690,054",1/1/2009,82,"dance-pop, electronic, hip hop, pop, pop rap, west coast hip hop",2045647
2844,ScHoolboy Q,X,8,,28,"12,092,598","54,591,275",2/13/2025,61,"gangsta rap, hardcore hip hop, hip hop, trap, west coast hip hop",9463
2845,Joost,Europapa,4,,31,"19,505,537","54,559,026",2/29/2024,66,"eurovision 2024 artists, hip hop, rap",289228
2846,Xavi,Modo DND,6,,127,"9,865,515","54,514,795",10/11/2024,64,"alternative r&b, contemporary r&b, hardcore hip hop, hip hop, hip-hop, pop, pop rap, r&b, trap, trap rap",34163
2847,Drake,Circo Loco,4,,11,"27,146,389","54,494,181",11/4/2022,68,"alternative r&b, contemporary r&b, hardcore hip hop, hip hop, hip-hop, pop, pop rap, r&b, trap, trap rap",383644
2848,blackbear,do re mi,14,,131,"4,240,473","54,438,140",4/21/2017,69,"alternative r&b, english, hip hop, pop rap, rap",462504
2849,Niall Horan,Heaven,5,,25,"17,213,555","54,389,656",2/9/2012,57,pop,342266
2850,Ariana Grande,fake smile,5,,11,"23,966,386","54,328,816",2/8/2019,63,"contemporary r&b, dance-pop, pop, r&b, trap soul",473245
2851,J Balvin,Ambiente,11,,109,"5,654,634","54,204,917",5/25/2018,61,"hip hop, latin, latin pop, pop, reggaeton",59220
2852,4batz,act ii: date @ 8,6,,132,"9,707,311","24,862,884",3/8/2024,71,"alternative r&b, trap soul",417611
2853,KAROL G,Mi Cama - Remix,10,,76,"7,038,544","54,166,392",5/3/2019,49,"latin, latin urban, r&b, reggaeton, spanish",40932
2854,Zé Felipe,Malvada,8,,58,"8,678,934","54,150,868",4/8/2025,54,"alternative r&b, contemporary r&b, hardcore hip hop, hip hop, hip-hop, pop, pop rap, r&b, trap, trap rap",71530
2855,Reik,Ya Me Enteré,18,,108,"3,451,576","54,149,831",6/17/2016,76,"ballad, latin, latin ballad, latin pop, pop, pop rock",88225
2856,Sabrina Carpenter,A Nonsense Christmas,3,,37,"24,883,797","54,117,711",11/17/2023,60,"2020s, dance-pop, electropop, pop",454498
2857,Lizzo,Rumors,6,,21,"15,932,972","54,106,792",4/26/2017,68,"contemporary r&b, hip hop, pop rap, pop soul, r&b, rap",2179
2858,Melanie Martinez,Pity Party,17,,82,"3,711,666","54,088,369",8/14/2015,69,"2010s, 2020s, alternative pop, art pop, creepy pop, dark pop, emo pop, indie pop, millennial",740957
2859,NAV,Turks,6,,25,"15,141,854","32,120,002",5/8/2020,63,"alternative r&b, canadian hip hop, hip hop, pop rap, trap",3301
2860,TOTO,Hold the Line,6,,157,"9,750,966","54,007,393",10/10/1978,83,"africa, american, aor, hard rock, jazz fusion, neo-progressive rock, nuno, pagan black metal, pop rock, progressive rock, rock, soft rock, west coast rock, yacht rock",1353487
2861,Drake,Childs Play,18,,64,"5,019,288","53,939,849",4/8/2014,66,"alternative r&b, contemporary r&b, hardcore hip hop, hip hop, hip-hop, pop, pop rap, r&b, trap, trap rap",365600
2862,Jimin,Closer Than This,5,,65,"15,244,839","53,871,117",7/19/2024,70,"ballad, dance-pop, edm, pop, r&b",183827
2863,The Weeknd,Try Me,5,1,6,"24,189,356","53,870,506",3/30/2018,70,"2010s, 2020s, alternative r&b, contemporary r&b, dance-pop, hypnagogic pop, pop, r&b, synth-pop",509679
2864,Taylor Swift,Gorgeous,8,,11,"16,903,463","53,823,628",11/10/2017,75,"2000s, 2010s, 2020s, alternative pop, artist of the decade, contemporary country, 
country, country pop, cultural icon, electropop, female vocals, icon, indie folk, late 2000s, millennial, 
nuno, pop, pop rock, re-recording, singer-songwriter, singer/songwriter, synth-pop, love",801608
2865,21 Savage,monster,7,,47,"10,766,402","53,806,382",8/21/2009,81,"gangsta rap, hip hop, mumble rap, pop rap, southern hip hop, trap",232747
2866,Beyoncé,ALIEN SUPERSTAR,6,,24,"14,938,140","53,719,561",7/29/2022,68,"2000s, 2010s, 2020s, adult contemporary, alternative r&b, american, americana, contemporary r&b, country, cultural icon, dance, dance-pop, dancer, disco, electropop, funk, grammy winner, hip hop, house, pianist, pop, pop rap, pop soul, progressive house, r&b, singer-songwriter, soul, vocalist",626539
2867,JENNIE,Handlebars,4,,26,"19,501,318","53,676,138",3/6/2025,64,"2020s, 3rd gen k-pop, hip hop, k-pop, pop",9785
2868,Agust D,Haegeum,4,,21,"20,079,597","53,523,617",4/21/2023,85,"ballad, hip hop, rap",340299
2869,Trey Songz,Slow Motion,27,,54,"3,506,031","53,474,556",6/23/2015,68,"contemporary r&b, electropop, hip hop, pop rap, r&b, soul",255671
2870,A Great Big World,Say Something,29,,29,"2,923,728","53,471,527",1/20/2014,71,"alternative r&b, contemporary r&b, hardcore hip hop, hip hop, hip-hop, pop, pop rap, r&b, trap, trap rap",660280
2871,James Hersey,Miss You,16,,95,"3,798,472","53,452,222",2/1/2023,59,"indie pop, singer-songwriter",78185
2872,Charly Black,Gyal You A Party Animal - Remix,15,,129,"4,128,282","53,436,882",10/12/2016,70,"dancehall, reggae, soca",64324
2873,Kendrick Lamar,hey now,3,,15,"28,656,384","53,254,728",11/22/2024,73,"2010s, 2020s, alternative hip hop, conscious hip hop, hardcore hip hop, hip hop, jazz rap, pop, pop rap, rap, trap, west coast hip hop",336840
2874,j-hope,Sweet Dreams,4,,37,"17,335,362","53,250,665",1/4/1983,83,"dance-pop, hip hop, k-pop, pop, r&b",630
2875,Jason Derulo,Get Ugly,17,,56,"4,058,565","53,244,040",5/29/2015,59,"2010s, contemporary r&b, dance, dance-pop, english, pop, r&b",2309
2876,2 Chainz,4:00 AM,12,,83,"5,955,458","53,208,336",9/21/1978,67,"2010s, criminal, dirty south, hardcore hip hop, hip hop, southern hip hop, trap",237798
2877,Future,Wicked,19,,99,"3,343,829","53,155,386",6/23/2025,73,"english, hip hop, southern hip hop, trap, trap rap",212074
2878,Tori Kelly,Hollow,23,,100,"2,770,900","53,143,616",6/11/2025,74,"contemporary r&b, pop, soul",85867
2879,SUICIDAL-IDOL,ecstacy (slowed),6,,120,"9,520,968","53,122,034",6/6/2023,75,"glitch pop, hyperpop, scenecore",417722
2880,Olivia Rodrigo,the grudge,4,,15,"21,850,809","53,080,040",9/8/2023,75,"2020s, folk pop, musical, pop, pop punk, pop rock, power pop, singer-songwriter",699122
2881,Hailee Steinfeld,Rock Bottom,17,,79,"3,797,762","53,073,635",9/9/2016,30,"dance-pop, electropop, nuno, synthpop",224209
2882,TAEYANG,VIBE,5,,32,"16,482,813","53,057,038",7/20/2025,35,k-pop,3814
2883,Khalid,Suncity,6,,26,"13,693,043","53,040,197",12/13/2011,12,"contemporary r&b, hip hop, leftfield, pop, r&b, singer-songwriter",3241
2884,JENNIE,You & Me,5,,56,"13,912,233","53,027,200",6/23/2010,43,"2020s, 3rd gen k-pop, hip hop, k-pop, pop",318261
2885,OneRepublic,Start Again,8,,45,"9,837,974","52,941,736",5/28/2021,36,"folk pop, pop, pop rock, rock",9122
2886,Future,PUFFIN ON ZOOTIEZ,7,,40,"11,475,324","52,936,167",4/29/2022,74,"english, hip hop, southern hip hop, trap, trap rap",643808
2887,Ozuna,Te Soñé De Nuevo,10,,119,"5,944,845","4,280,156",11/29/2019,54,"latin, latin trap, latin urban, reggaeton, trap latino",26539
2888,Roddy Ricch,Late At Night,8,,58,"9,624,634","52,880,136",12/17/2021,66,"english, hip hop, rap, trap",237323
2889,Chefin,212,8,,89,"7,491,127","52,842,792",11/7/2014,69,trap,88804
2890,Ed Sheeran,Nancy Mulligan,7,,26,"15,943,608","52,834,408",3/3/2017,66,"dance-pop, folk, folk pop, guitarist, music for soccer moms, persian pop, pop, singer, singer-songwriter, soft rock, uk",205465
2891,Drake,Elevate,5,1,9,"26,995,718","52,814,999",10/22/2021,62,"alternative r&b, contemporary r&b, hardcore hip hop, hip hop, hip-hop, pop, pop rap, r&b, trap, trap rap",219884
2892,Drake,Family Matters,3,,17,"26,302,381","52,787,956",5/3/2024,70,"alternative r&b, contemporary r&b, hardcore hip hop, hip hop, hip-hop, pop, pop rap, r&b, trap, trap rap",389788
2893,Cynthia Erivo,Defying Gravity,4,,61,"15,483,743","52,785,699",11/22/2024,73,soul,393636
2894,Jin,The Astronaut,5,,32,"17,902,778","52,726,701",10/28/2022,69,"k-pop, pop",291697
2895,Red Velvet,Psycho,8,,54,"9,132,322","52,700,432",12/23/2019,69,"3rd gen k-pop, girl group, j-pop, k-pop, kpop, r&b",683972
2896,Drake,What Did I Miss?,4,,30,"17,098,712","52,678,170",7/5/2025,83,"alternative r&b, contemporary r&b, hardcore hip hop, hip hop, hip-hop, pop, pop rap, r&b, trap, trap rap",250409
2897,Migrantes,Si Me Tomo Una Cerveza,9,,132,"6,624,690","52,625,205",11/7/2020,62,"alternative r&b, contemporary r&b, hardcore hip hop, hip hop, hip-hop, pop, pop rap, r&b, trap, trap rap",23986
2898,Offset,Clout,10,,121,"5,772,146","52,598,193",2/22/2019,66,"hip hop, southern hip hop, trap",6824
2899,Bad Bunny,PA' ROMPERLA,8,,47,"10,729,401","52,586,578",5/10/2020,65,"hip hop, latin, latin trap, reggaeton, trap latino",93946
2900,Lorde,Ribs,6,,157,"9,200,865","52,578,996",9/27/2013,84,"2010s, alternative pop, alternative rock, art pop, dance-pop, folk pop, indie pop, indietronica, pop, singer-songwriter, synth-pop",1675469
2901,TWICE,I CAN'T STOP ME,8,,68,"9,271,828","52,558,784",10/26/2020,72,"3rd gen k-pop, dance, dance-pop, electronica, female vocals, girl group, j-pop, k-pop, korean, pop, r&b",626451
2902,Rita Ora,Girls,8,,52,"8,480,999","52,543,183",6/15/2018,73,"contemporary r&b, dance-pop, electropop, pop, pop rock",7144
2903,Nause,Dynamite,13,,75,"4,789,358","52,513,558",8/28/2020,61,"alternative r&b, contemporary r&b, hardcore hip hop, hip hop, hip-hop, pop, pop rap, r&b, trap, trap rap",1202
2904,Ella Mai,Boo'd Up,9,,58,"8,027,586","52,481,483",2/22/2017,68,"alternative r&b, contemporary r&b, dance-pop, pop, pop rap, trap soul",287692
2905,Eden Muñoz,Abcdario,5,,53,"13,360,132","52,476,603",5/13/2023,74,"corrido, corrido tumbado, latin, latin pop, norteño, regional mexicano, serrieno-banda",46741
2906,Post Malone,Takin' Shots,6,,19,"19,954,804","52,463,959",4/27/2018,58,"2010s, 2020s, alternative r&b, cloud rap, contemporary r&b, country, english, hip hop, pop rap, r&b, trap",199797
2907,Crissin,Poblado,6,,59,"9,967,160","52,439,375",9/19/2025,31,"latin, reggaeton",21544
2908,ZAAC,Desce Pro Play (PA PA PA),10,,112,"6,241,031","52,421,913",6/26/2020,58,"alternative r&b, contemporary r&b, hardcore hip hop, hip hop, hip-hop, pop, pop rap, r&b, trap, trap rap",61583
2909,6ix9ine,TATI,11,,82,"6,706,761","52,397,010",12/18/2018,72,"2010s, drill, east coast hip hop, hardcore hip hop, hip hop, trap",87912
2910,Os Barões Da Pisadinha,Recairei - Ao Vivo,10,,117,"6,872,561","52,394,862",10/15/2020,56,"alternative r&b, contemporary r&b, hardcore hip hop, hip hop, hip-hop, pop, pop rap, r&b, trap, trap rap",113391
2911,sangiovanni,malibu,8,,81,"8,108,340","52,348,105",10/5/2018,73,"alternative r&b, contemporary r&b, hardcore hip hop, hip hop, hip-hop, pop, pop rap, r&b, trap, trap rap",23809
2912,Various Artists,Happy,22,1,10,"3,422,590","52,334,541",2/12/2021,50,"1990s, 2000, 2000s, 2001, 2002, 2004, abrasive sound placed them firmly within the late‑1990s/early‑2000s underground, active 1998–2002. emerging from the tidewater crust‑punk/skate scene, alabama thunderpussy, and clutch. in 2011, and their influence continues to be cited by later generations of extreme bands. disambiguation: this is mugwart (virginia beach, boot land, compilation, compilation. crushers killers destroyers! — shifty records (sh08, compilation. doomed — this dark reign recordings (tdr‑001, compilation. mugwart performed throughout virginia and the surrounding region, damad, fistula, foundational act of the virginia sludge/punk/doom underground. their recordings circulate digitally via bandcamp and streaming platforms, france), highlighting the group’s ongoing resonance nearly a decade after disbanding. legacy: though short‑lived, lamb of god, mugwart (has nothing to do with (“mugwort”), mugwart is regarded as a cult, mugwart was a sludge/punk/doom/hardcore band from virginia beach, needs to be removed, s.a. souvenirs, sharing stages with grief, shifty records (sh09, sludge hardcore punk, sofa king killer, special purpose, special purpose artist, tdr‑13, the group combined punk urgency and hardcore aggression with downtuned sludge heaviness and doom atmosphere. their raw, uk extreme‑metal band dragged into sunlight selected mugwart’s track “fallen” for a curated mixtape in terrorizer magazine (issue #285), usa), va, virginia, virginia beach, which compiles studio material from 1999–2002. tracks were originally issued (or intended) across several small‑label documents: “before you / fallen” — acrude records (crude‑01, while maintaining a distinctly punk ethos. the band’s definitive release is discography (this dark reign recordings",23
2913,Musical Youth,Pass The Dutchie,7,,85,"8,759,142","52,283,858",2/28/1994,65,"classic pop and rock, reggae, reggae-pop",502535
2914,Flo Rida,Cake - Challenge Version,12,,90,"4,974,133","52,283,093",12/16/2016,53,"dance-pop, electronic, electropop, film soundtrack, happy, hip hop, hip house, hip-hop, not acoustic, not aggressive, not relaxed, not sad, party, pop rap, rap, southern hip hop",21850
2915,Drake,Free Smoke,7,,16,"16,788,462","52,177,024",3/18/2017,61,"alternative r&b, contemporary r&b, hardcore hip hop, hip hop, hip-hop, pop, pop rap, r&b, trap, trap rap",295768
2916,Camila Cabello,OMG,10,,83,"5,983,334","52,171,584",1/2/2023,78,"dance-pop, electropop, hyperpop, latin pop, pop, r&b",83178
2917,"Tyler, The Creator",Rah Tah Tah,3,,20,"23,213,440","52,150,588",10/28/2024,73,"hardcore hip hop, hip hop, horrorcore, west coast hip hop",1009277
2918,Jessie Murph,Blue Strips,6,,119,"10,087,389","52,148,528",5/23/2025,61,"2020s, country pop, country soul",89535
2919,Regard,You,9,,84,"7,013,185","52,076,821",4/27/2017,81,"dance, dj, english",365069
2920,Travis Scott,Watch,7,,27,"13,476,602","52,059,877",2014,45,"english, experimental hip hop, hip hop, pop rap, rap, southern hip hop, trap",2751
