Id,Artist,Title,Wks,T10,PK,Pkstreams,Total,ReleaseDate,Popularity,Genre,Unique_Listener
1,The Weeknd,Blinding Lights,304,64,1,"52,375,259","4,983,733,373",3/20/2020,89,"acoustic rock, flamenco, flamenco nuevo, folk rock, jazz fusion, latin, nuevo flamenco, world",2180511
2,Ed Sheeran,Shape of You,381,34,1,"64,217,796","4,026,397,140",3/3/2017,88,"dance-pop, folk, folk pop, guitarist, music for soccer moms, persian pop, pop, singer, singer-songwriter, soft rock, uk",1237055
3,Harry Styles,As It Was,176,60,1,"78,460,903","3,952,254,943",5/20/2022,87,"hip hop, rap, pop",1842227
4,Lewis Capaldi,Someone You Loved,334,15,4,"24,962,682","3,863,377,350",5/17/2019,87,"blue-eyed soul, pop, scottish, singer-songwriter",994310
5,Post Malone,Sunflower - Spider-Man: Into the Spider-Verse,325,31,1,"34,579,416","3,602,534,519",12/14/2018,82,"2010s, 2020s, alternative r&b, cloud rap, contemporary r&b, country, english, hip hop, pop rap, r&b, trap",1637471
6,The Neighbourhood,Sweater Weather,290,30,16,"21,624,450","3,451,043,220",4/22/2013,91,"alternative rock, indie pop, tumblr",2698243
7,Billie Eilish,lovely,383,21,24,"14,081,242","3,370,150,610",4/19/2018,87,"2010s, 2020s, alt-pop, alternative pop, alternative r&b, art pop, bedroom pop, contemporary r&b, dark pop, electronic, electronica, electropop, gen z, indie pop, nepo baby, pity pop, pop, pop rock, pop soul, queer, singer-songwriter",87015
8,Imagine Dragons,Believer,422,20,16,"16,864,827","3,327,246,512",6/23/2017,87,electronic,1166235
9,Ed Sheeran,Perfect,414,15,4,"24,763,619","3,331,984,067",6/27/2024,59,"dance-pop, folk, folk pop, guitarist, music for soccer moms, persian pop, pop, singer, singer-songwriter, soft rock, uk",969875
10,The Weeknd,Starboy,274,21,1,"35,360,281","3,322,003,875",11/25/2016,89,"2010s, 2020s, alternative r&b, contemporary r&b, dance-pop, hypnagogic pop, pop, r&b, synth-pop",2131976
11,The Weeknd,Blinding Lights,304,64,1,"52,375,259","4,983,733,373",3/20/2020,89,"acoustic rock, flamenco, flamenco nuevo, folk rock, jazz fusion, latin, nuevo flamenco, world",2180511
12,Ed Sheeran,Shape of You,381,34,1,"64,217,796","4,026,397,140",3/3/2017,88,"dance-pop, folk, folk pop, guitarist, music for soccer moms, persian pop, pop, singer, singer-songwriter, soft rock, uk",1237055
13,Harry Styles,As It Was,176,60,1,"78,460,903","3,952,254,943",5/20/2022,87,"hip hop, rap, pop",1842227
14,Lewis Capaldi,Someone You Loved,334,15,4,"24,962,682","3,863,377,350",5/17/2019,87,"blue-eyed soul, pop, scottish, singer-songwriter",994310
15,Post Malone,Sunflower - Spider-Man: Into the Spider-Verse,325,31,1,"34,579,416","3,602,534,519",12/14/2018,82,"2010s, 2020s, alternative r&b, cloud rap, contemporary r&b, country, english, hip hop, pop rap, r&b, trap",1637471
16,The Neighbourhood,Sweater Weather,290,,16,"21,624,450","3,451,043,220",4/22/2013,91,"alternative rock, indie pop, tumblr",2698243
17,Billie Eilish,lovely,383,,24,"14,081,242","3,370,150,610",4/19/2018,87,"2010s, 2020s, alt-pop, alternative pop, alternative r&b, art pop, bedroom pop, contemporary r&b, dark pop, electronic, electronica, electropop, gen z, indie pop, nepo baby, pity pop, pop, pop rock, pop soul, queer, singer-songwriter",87015
18,Imagine Dragons,Believer,422,,16,"16,864,827","3,327,246,512",6/23/2017,87,"alternative pop, alternative rock, electropop, indie pop, indietronica, nuno, pop, pop rock, rock",1166235
19,Ed Sheeran,Perfect,414,15,4,"24,763,619","3,331,984,067",6/27/2024,59,"dance-pop, folk, folk pop, guitarist, music for soccer moms, persian pop, pop, singer, singer-songwriter, soft rock, uk",969875
20,The Weeknd,Starboy,274,21,1,"35,360,281","3,322,003,875",11/25/2016,89,"2010s, 2020s, alternative r&b, contemporary r&b, dance-pop, hypnagogic pop, pop, r&b, synth-pop",2131976
21,The Kid LAROI,Stay,175,43,1,"70,502,410","3,261,615,570",7/9/2021,80,"emo rap, english, hip hop, pop rap, rap",38001
22,Billie Eilish,BIRDS OF A FEATHER,71,66,1,"66,726,270","3,032,131,526",5/17/2024,94,"2010s, 2020s, alt-pop, alternative pop, alternative r&b, art pop, bedroom pop, contemporary r&b, dark pop, electronic, electronica, electropop, gen z, indie pop, nepo baby, pity pop, pop, pop rock, pop soul, queer, singer-songwriter",2006644
23,Glass Animals,Heat Waves,194,37,1,"31,668,100","3,002,545,699",8/7/2020,86,"electronic, english, indie, indie pop, indie rock, indietronica, pop, psychedelic pop, psychedelic rock, trip-hop, uk",1414443
24,Lady Gaga,Die With A Smile,58,55,1,"78,624,101","2,963,814,968",8/16/2024,92,"2000s, 2010s, 2020s, adult contemporary, americana, dance, dance-pop, electro house, electronic, electropop, film soundtrack, industrial pop, jazz, late 2000s, millennial, pop, pop rock, synth-pop, synthpop",1585624
25,Drake,One Dance,282,26,1,"47,782,311","2,856,535,440",5/6/2016,87,"hip hop, rap, pop",1725791
26,Tom Odell,Another Love,233,,15,"20,219,891","2,802,580,638",6/24/2013,87,"indie folk, indie pop, singer-songwriter",1345942
27,Arctic Monkeys,I Wanna Be Yours,168,,15,"21,021,481","2,793,423,185",9/9/2013,91,"alternative rock, art rock, baroque pop, british, garage rock, garage rock revival, indie rock, neo-psychedelia, post-punk revival, psychedelic pop, psychedelic rock, sheffield, uk",2383996
28,Taylor Swift,Cruel Summer,138,37,2,"35,517,192","2,650,913,479",8/23/2019,88,"special purpose, special purpose artist",1596156
29,Harry Styles,Watermelon Sugar,225,18,4,"28,265,526","2,600,844,950",12/13/2019,83,"2020s, funk, new wave, nuno, pop, rock, soft rock, soul, synth-pop",1404288
30,James Arthur,Say You Won't Let Go,352,15,7,"19,297,939","2,581,216,939",10/28/2016,86,"hip hop, rap, pop",884575
31,Coldplay,Yellow,249,,19,"19,818,571","2,588,953,124",7/10/2000,91,"alternative rock, ambient pop, art pop, big music, britannique, british, britpop, chapel, dream pop, english, indie pop, indie rock, parlophone, piano pop, piano rock, pop, pop rock, pop/rock, post-britpop, rock, rock and indie, uk",3375560
32,Tones And I,Dance Monkey,151,41,1,"52,055,226","2,538,070,349",10/17/2019,74,"dance-pop, electropop, english, indie pop, pop soul",716120
33,Sabrina Carpenter,Espresso,76,32,1,"76,427,890","2,523,306,461",4/12/2024,85,"2020s, dance-pop, electropop, pop",1973241
34,Vance Joy,Riptide,372,,16,"16,836,644","2,485,834,943",9/8/2014,81,"alternative rock, folk pop, indie folk, indie pop, singer-songwriter",1951098
35,Miley Cyrus,Flowers,115,25,1,"115,156,896","2,459,389,429",8/18/2023,85,"2010s, contemporary r&b, dance-pop, electropop, pop, pop rock, power pop, queer, rock, teen pop",1116518
36,Benson Boone,Beautiful Things,88,30,1,"55,391,293","2,469,636,608",1/18/2024,84,"2020s, pop, pop rock",857167
37,SZA,Kill Bill,121,26,1,"55,234,610","2,413,447,813",12/9/2022,77,"alternative r&b, american, contemporary r&b, electronic, hip hop soul, neo soul, pop, r&b",2038216
38,The Chainsmokers,Something Just Like This,278,12,2,"33,173,199","2,390,174,506",2/22/2017,72,"2010s, dance-pop, edm, electro house, electronic, electropop, future bass, satire",1114354
39,The Weeknd,Die For You,193,,12,"22,988,828","588,484,750",11/25/2016,79,"2010s, 2020s, alternative r&b, contemporary r&b, dance-pop, hypnagogic pop, pop, r&b, synth-pop",1818625
40,Jung Kook,Seven,115,22,1,"89,748,171","2,353,289,191",11/3/2023,83,"edm, k-pop, pop, r&b",3919
41,OneRepublic,Counting Stars,382,24,3,"11,170,130","2,338,993,893",1/1/2013,87,"folk pop, pop, pop rock, rock",1858310
42,The Chainsmokers,Closer,237,28,1,"46,300,740","2,117,566,874",7/29/2016,86,"2010s, dance-pop, edm, electro house, electronic, electropop, future bass, satire",1221447
43,Dua Lipa,Don't Start Now,164,33,2,"37,779,776","2,095,527,045",3/27/2020,82,"alternative pop, boogie, contemporary r&b, dance-pop, dream pop, electropop, europop, funktronica, girlpower, house, house music, indie pop, left-field pop, nu disco, nuno, pop, synth-pop",1448362
44,Hozier,Take Me To Church,313,20,1,"13,212,580","2,082,227,137",9/19/2014,82,"adult alternative pop/rock, alternative, alternative/indie rock, blues, blues rock, chamber pop, contemporary singer/songwriter, folk rock, indie rock, pop, pop rock, pop soul, r&b, rock, singer-songwriter, soul",2072630
45,Shawn Mendes,Señorita,146,23,1,"67,237,638","2,072,961,200",6/21/2019,80,"2010s, 2020s, english, folk pop, pop, pop rock, pop soul, teen pop",859318
46,Post Malone,rockstar,172,27,1,"46,995,997","2,072,812,831",6/27/2024,74,"2010s, 2020s, alternative r&b, cloud rap, contemporary r&b, country, english, hip hop, pop rap, r&b, trap",256302
47,Lord Huron,The Night We Met,153,,15,"21,456,993","2,069,959,610",4/6/2015,90,"indie folk, indie rock, nuno",1672754
48,The Weeknd,One Of The Girls,103,12,3,"33,826,703","2,050,965,604",6/23/2023,91,"2010s, 2020s, alternative r&b, contemporary r&b, dance-pop, hypnagogic pop, pop, r&b, synth-pop",108124
49,Teddy Swims,Lose Control,98,9,5,"33,398,917","2,000,543,529",6/23/2023,81,"alternative rock, country, pop, pop soul, rhythm & blues, rock, soul",752455
50,Elton John,Cold Heart - PNAU Remix,145,28,4,"28,043,005","1,974,787,398",8/13/2021,81,"adult contemporary, british, classic rock, piano rock, pop, pop rock, rock, rock and roll, singer-songwriter, singer/songwriter, soft rock",823709
51,Arctic Monkeys,505,194,,43,"13,120,065","1,967,628,879",4/22/2007,86,"alternative rock, art rock, baroque pop, british, garage rock, garage rock revival, indie rock, neo-psychedelia, post-punk revival, psychedelic pop, psychedelic rock, sheffield, uk",2767053
52,ROSÉ,APT.,49,36,1,"87,041,494","1,967,833,416",10/18/2024,89,"2020s, 3rd gen k-pop, ballad, k-pop, korean ballad, pop",1226996
53,Manuel Turizo,La Bachata,122,25,4,"30,443,567","1,937,228,986",5/26/2022,78,"latin, latin pop, latin urban, reggaeton",361527
54,Travis Scott,goosebumps,280,,13,"22,652,793","1,930,715,182",9/16/2016,84,"english, experimental hip hop, hip hop, pop rap, rap, southern hip hop, trap",1578205
55,Jimin,Who,62,27,1,"64,762,611","1,948,685,337",7/19/2024,87,"ballad, dance-pop, edm, pop, r&b",379950
56,Juice WRLD,Lucid Dreams,204,15,3,"27,389,019","1,911,008,149",12/10/2018,82,"2020s, cloud rap, emo rap, hip hop, look again, rap, trap",1180363
57,Post Malone,Circles,171,18,1,"43,379,405","1,905,867,050",9/6/2019,85,"2010s, 2020s, alternative r&b, cloud rap, contemporary r&b, country, english, hip hop, pop rap, r&b, trap",1401999
58,Tate McRae,greedy,100,29,1,"40,228,313","1,915,490,679",9/15/2023,88,"2020s, alternative pop, contemporary r&b, dance-pop, female vocals, pop, pop rock",1160969
59,Billie Eilish,bad guy,135,24,1,"50,342,324","1,896,726,225",3/29/2019,81,"hip hop, rap, pop",1567845
60,David Guetta,I'm Good (Blue),117,21,2,"34,345,014","1,880,998,531",8/26/2022,85,"dance, dance-pop, electro house, electronic, electropop, english, festival progressive house, future rave, house, tech house",749470
61,Eminem,Without Me,213,,31,"14,105,930","1,855,557,321",1/17/2020,82,"actor, boom bap, conscious hip hop, detroit, detroit hip hop, hardcore hip hop, hip hop, hip-hop, horrorcore, midwest hip hop, midwestern hip-hop, music trade, pop rap, rap, record producer, singer, songwriter, trap",2171005
62,"Tyler, The Creator",See You Again,135,,16,"20,536,166","1,839,524,349",1/29/2016,58,"hardcore hip hop, hip hop, horrorcore, west coast hip hop",219359
63,Coldplay,Viva La Vida,165,,31,"18,240,182","1,834,343,931",6/6/2008,86,"alternative rock, ambient pop, art pop, big music, britannique, british, britpop, chapel, dream pop, english, indie pop, indie rock, parlophone, piano pop, piano rock, pop, pop rock, pop/rock, post-britpop, rock, rock and indie, uk",3351611
64,Mariah Carey,All I Want for Christmas Is You,83,37,1,"92,506,541","1,823,145,266",10/28/1994,74,"metal, metalcore, rock",2008404
65,The Police,Every Breath You Take,198,,36,"15,898,344","1,833,826,049",6/17/1983,90,rock,2507228
66,FloyyMenor,Gata Only,85,22,3,"54,990,825","1,786,874,303",2/2/2024,85,"hip hop, rap, pop",512752
67,The Weeknd,Save Your Tears,171,13,2,"30,115,082","661,883,213",3/20/2020,86,"hip hop, rap, pop",1705044
68,Chappell Roan,"Good Luck, Babe!",76,19,6,"40,219,805","1,759,837,057",4/5/2024,89,"alternative pop, dance-pop, electropop, gay pop, indie pop, pop, pop rock, queer, sapphic, singer-songwriter, synth-pop",1890335
69,Lady Gaga,Shallow,182,12,3,"31,597,226","1,738,805,577",10/5/2018,84,"2000s, 2010s, 2020s, adult contemporary, americana, dance, dance-pop, electro house, electronic, electropop, film soundtrack, industrial pop, jazz, late 2000s, millennial, pop, pop rock, synth-pop, synthpop",859045
70,Bruno Mars,Locked out of Heaven,201,,23,"19,098,304","1,721,237,885",12/7/2012,87,"2010s, funk, music for soccer moms, pop, r&b, relic inn, rock, soul",2224936
71,Hozier,Too Sweet,79,13,2,"56,325,657","1,691,896,990",3/22/2024,75,"adult alternative pop/rock, alternative, alternative/indie rock, blues, blues rock, chamber pop, contemporary singer/songwriter, folk rock, indie rock, pop, pop rock, pop soul, r&b, rock, singer-songwriter, soul",1264663
72,The Walters,I Love You So,171,,21,"14,526,745","1,689,762,209",11/28/2014,87,"indie pop, indie rock",1579000
73,OneRepublic,I Ain't Worried,114,8,7,"25,270,059","1,663,352,530",5/13/2022,81,"folk pop, pop, pop rock, rock",871639
74,Ruth B.,Dandelions,173,,34,"11,383,604","1,653,359,488",5/5/2017,85,"piano rock, pop rock, singer/songwriter",823651
75,Kendrick Lamar,Not Like Us,72,17,2,"73,078,518","1,660,197,735",5/4/2024,87,"2010s, 2020s, alternative hip hop, conscious hip hop, hardcore hip hop, hip hop, jazz rap, pop, pop rap, rap, trap, west coast hip hop",1791319
76,Ed Sheeran,Photograph,307,,15,"11,105,681","1,654,552,631",6/21/2014,86,"dance-pop, folk, folk pop, guitarist, music for soccer moms, persian pop, pop, singer, singer-songwriter, soft rock, uk",1145569
77,Lil Nas X,INDUSTRY BABY,81,40,2,"53,085,371","1,632,867,564",7/23/2021,74,"2020s, hip hop, lgbtqi, pop rap, queer, relic inn, trap",67463
78,Cigarettes After Sex,Apocalypse,167,,62,"13,385,982","1,636,336,811",6/9/2017,89,"ambient, ambient pop, androgynous vocals, dream pop, ethereal, indie pop, indie rock, shoegaze, slowcore",1877495
79,Djo,End of Beginning,84,8,3,"54,716,193","1,635,508,733",9/16/2022,89,"bedroom pop, indie pop, indie rock, neo-psychedelia",1569002
80,Olivia Rodrigo,good 4 u,78,17,1,"84,131,760","1,618,703,681",5/21/2021,82,"2020s, folk pop, musical, pop, pop punk, pop rock, power pop, singer-songwriter",1681778
81,Adele,Easy On Me,114,22,1,"84,952,932","1,602,558,038",10/14/2021,78,"2010s, aln-sh, blue-eyed soul, blues-pop, neo soul, pop, pop soul, r&b, soul",1030395
82,Bad Bunny,Me Porto Bonito,81,27,2,"39,839,157","1,595,512,799",5/6/2022,81,"hip hop, latin, latin trap, reggaeton, trap latino",622072
83,Olivia Rodrigo,drivers license,98,16,1,"80,764,045","1,590,283,541",5/21/2021,85,classical crossover,1489957
84,Ariana Grande,we can't be friends (wait for your love),81,7,1,"60,418,741","1,600,899,469",3/8/2024,87,"contemporary r&b, dance-pop, pop, r&b, trap soul",1240598
85,Dua Lipa,Levitating,116,12,4,"30,358,414","1,576,155,950",3/27/2020,80,"alternative pop, boogie, contemporary r&b, dance-pop, dream pop, electropop, europop, funktronica, girlpower, house, house music, indie pop, left-field pop, nu disco, nuno, pop, synth-pop",1114066
86,Sabrina Carpenter,Please Please Please,66,19,1,"85,283,851","1,574,814,640",6/6/2024,79,"2020s, dance-pop, electropop, pop",1570014
87,Kendrick Lamar,All The Stars,119,10,2,"44,478,255","1,565,415,428",2/9/2018,90,"2010s, 2020s, alternative hip hop, conscious hip hop, hardcore hip hop, hip hop, jazz rap, pop, pop rap, rap, trap, west coast hip hop",59759
88,Ariana Grande,7 rings,143,16,1,"71,467,874","1,547,429,518",2/8/2019,84,"contemporary r&b, dance-pop, pop, r&b, trap soul",1545684
89,Wham!,Last Christmas,78,29,2,"91,090,914","1,531,155,898",11/29/1984,74,"christmas music, dance-pop, pop, queer, synth-pop",1784494
90,XXXTENTACION,SAD!,163,12,1,"38,010,231","1,531,066,913",3/16/2018,79,"death by murder, emo rap, hip hop, rap, southern hip hop, trap, trap metal",1070775
91,SZA,Snooze,124,,27,"17,296,437","1,527,001,258",12/9/2022,86,"alternative r&b, american, contemporary r&b, electronic, hip hop soul, neo soul, pop, r&b",1416540
92,XXXTENTACION,Jocelyn Flores,217,2,7,"25,442,646","1,511,632,218",8/25/2017,78,"death by murder, emo rap, hip hop, rap, southern hip hop, trap, trap metal",1132039
93,Bruno Mars,That's What I Like,157,9,6,"23,602,385","1,520,422,827",11/17/2016,87,"2010s, funk, music for soccer moms, pop, r&b, relic inn, rock, soul",1613246
94,Taylor Swift,Anti-Hero,79,12,1,"82,935,273","1,501,835,240",10/21/2022,81,"2000s, 2010s, 2020s, alternative pop, artist of the decade, contemporary country, 
country, country pop, cultural icon, electropop, female vocals, icon, indie folk, late 2000s, millennial, 
nuno, pop, pop rock, re-recording, singer-songwriter, singer/songwriter, synth-pop, love",1295832
95,Billie Eilish,WILDFLOWER,71,2,9,"34,383,970","1,511,638,809",5/17/2024,92,"2010s, 2020s, alt-pop, alternative pop, alternative r&b, art pop, bedroom pop, contemporary r&b, dark pop, electronic, electronica, electropop, gen z, indie pop, nepo baby, pity pop, pop, pop rock, pop soul, queer, singer-songwriter",1416131
96,Queen,Bohemian Rhapsody - Remastered 2011,224,,11,"18,440,196","1,484,719,835",11/21/1975,81,"art rock, beholder, british, classic rock, glam rock, glorious, hard rock, pop rock, progressive rock, rock, symphonic rock, uk",1517501
97,Bizarrap,"Quevedo: Bzrp Music Sessions, Vol. 52",68,22,1,"54,841,779","1,466,812,232",7/6/2022,80,"pop, trap, trap edm, trap latino",352493
98,One Direction,Night Changes,170,1,8,"32,106,780","1,466,877,828",11/17/2014,86,"hip hop, rap, pop",1134227
99,Drake,God's Plan,104,21,1,"54,891,573","1,446,481,457",6/29/2018,84,"hip hop, rap, pop",1333180
100,Bruno Mars,When I Was Your Man,189,,38,"15,866,628","1,456,131,790",12/7/2012,87,"2010s, funk, music for soccer moms, pop, r&b, relic inn, rock, soul",1709025
101,Macklemore & Ryan Lewis,Can't Hold Us,164,,86,"11,440,256","339,327,547",10/9/2012,79,"hip hop, pop rap",59717
102,Shaboozey,A Bar Song (Tipsy),76,13,6,"45,881,416","1,440,720,347",4/12/2024,83,"country, country pop, hip hop, stomp and holler",577149
103,Justin Bieber,Ghost,134,,11,"17,091,238","1,439,847,387",3/19/2021,83,"2010s, 2020s, dance-pop, pop, pop rap, r&b, teen pop",753255
104,Lil Nas X,MONTERO (Call Me By Your Name),73,22,1,"55,582,612","1,435,081,319",9/17/2021,74,"2020s, hip hop, lgbtqi, pop rap, queer, relic inn, trap",1244391
105,Bruno Mars,Just the Way You Are,149,,34,"17,397,565","1,437,071,068",5/11/2010,85,"2010s, funk, music for soccer moms, pop, r&b, relic inn, rock, soul",2018360
106,KAROL G,Si Antes Te Hubiera Conocido,66,15,5,"41,120,665","1,433,408,220",6/21/2024,84,"latin, latin urban, r&b, reggaeton, spanish",426833
107,Travis Scott,SICKO MODE,147,21,2,"33,399,542","1,423,300,401",8/3/2018,82,"english, experimental hip hop, hip hop, pop rap, rap, southern hip hop, trap",1406838
108,Mitski,My Love Mine All Mine,76,18,3,"31,544,921","1,396,357,979",9/15/2023,86,"2010s, 2020s, alternative, alternative rock, alternative singer/songwriter, alternative/indie rock, art pop, folk punk, folk rock, garage rock, indie, indie dance, indie rock, j-pop, millennial, pop, punk rock, rock, singer-songwriter",1857845
109,SAINt JHN,Roses - Imanbek Remix,97,23,3,"35,360,782","1,393,342,289",8/25/2020,15,"hip hop, rap",577964
110,BTS,Dynamite,113,17,2,"39,904,687","1,387,320,531",8/28/2020,61,"2010s, 2020s, boy group, english, k-pop, pop",959398
111,The Goo Goo Dolls,Iris,108,,12,"20,902,350","1,400,327,091",9/15/2025,85,"', acoustic rock, alternative rock, hardcore punk, jangle pop, pop punk, pop rock, post-grunge, power pop, punk rock, soft rock",1088721
112,Maroon 5,Memories,127,15,2,"31,572,344","1,378,872,769",6/11/2021,82,"2010s, adult contemporary, alternative rock, dance-pop, funk rock, indie rock, late 2000s, music for soccer moms, pop, pop rock, rock",649075
113,J. Cole,No Role Modelz,227,,64,"11,091,492","1,369,389,336",12/9/2014,84,hip hop,1513054
114,24kGoldn,Mood,91,27,1,"41,500,977","1,364,348,925",3/26/2021,78,"2020s, cloud rap, english, hip hop, lo-fi hip hop, pop rap, rap, trap",13084
115,Keane,Somewhere Only We Know,148,,80,"11,650,746","1,373,507,239",5/10/2004,86,"alternative pop, alternative rock, english, indie pop, piano rock, pop rock, post-britpop, rock and indie, synth-pop",2328465
116,Ed Sheeran,Bad Habits,78,20,3,"38,983,802","1,345,540,456",10/25/2021,82,mashup,701259
117,French Montana,Unforgettable,126,15,3,"25,652,839","1,349,704,254",7/14/2017,85,"east coast hip hop, hip hop",1060103
118,Bad Bunny,DÁKITI,103,17,1,"53,344,093","1,340,268,006",10/30/2020,78,"hip hop, latin, latin trap, reggaeton, trap latino",507432
119,Sam Smith,Unholy,57,22,1,"53,478,156","1,326,886,078",9/22/2022,76,"alliteration, alternative r&b, blue-eyed soul, english, lgbtqi, nuno, pop, pop soul, queer, soul, synth funk",25758
120,Gracie Abrams,That’s So True,49,26,3,"47,295,577","1,334,044,602",10/18/2024,90,"2020s, bedroom pop, folk pop, pop, singer-songwriter",883614
121,Doja Cat,Kiss Me More,80,20,3,"37,723,231","1,319,804,269",6/25/2021,84,"alternative rock, grunge, hip hop, nuno, pop, pop rap, post-grunge, power pop, rap, rock, trap, west coast hip hop",16670
122,Marshmello,Happier,117,22,2,"28,685,390","1,314,561,043",5/21/2021,83,"edm, english, future bass, hip hop, progressive house, trap edm",787133
123,Gigi Perez,Sailor Song,58,13,7,"32,953,798","1,322,577,436",7/26/2024,87,"2020s, indie folk, indie pop, queer",1068034
124,Camila Cabello,Havana,114,25,1,"33,129,706","1,305,095,150",1/12/2018,81,"dance-pop, electropop, hyperpop, latin pop, pop, r&b",290198
125,Lana Del Rey,Summertime Sadness,144,,83,"10,683,039","1,313,138,859",1/1/2012,83,"2010s, 2020s, alternative, alternative pop, art pop, ballad, chamber pop, dream pop, electronic, hawaiian glam metal, indie pop, millennial, neo-psychedelia, pop, sad girl pop, singer-songwriter, trip hop, tumblr",2300747
126,Rema,Calm Down,82,3,9,"25,338,316","1,295,568,954",8/25/2022,80,"afrobeat, afrobeats, afrorave, nuno, trap",228936
127,Conan Gray,Heather,157,,12,"18,431,861","1,289,793,389",3/20/2020,84,"2020s, alternative pop, ballad, gen z, indie pop, pop, pop rock, queer, singer-songwriter, synth-pop",1389802
128,The Killers,Mr. Brightside,207,,94,"10,159,059","1,296,157,916",2004,88,"hip hop, rap, pop",3416984
129,John Legend,All of Me,310,15,3,"8,733,114","1,278,923,495",8/30/2013,85,"american, américain, contemporary r&b, neo soul, r&b, soul, soul and reggae, usa",1216734
130,Feid,LUNA,77,4,9,"28,125,311","1,275,818,674",4/18/2025,84,"latin, latin urban, reggaeton, trap latino",267169
131,Ed Sheeran,Thinking out Loud,241,22,1,"12,966,533","1,256,739,061",6/21/2014,83,"acoustic, cover songs, detroit, dirtdoggy productions, dj scoob, hip hop, kalamazoo, michigan, pop, r&b, rock, scoob",1161847
132,Bad Bunny,Tití Me Preguntó,62,24,4,"35,141,825","1,251,442,060",5/6/2022,83,"hip hop, latin, latin trap, reggaeton, trap latino",665065
133,Roddy Ricch,The Box,80,18,1,"48,937,592","1,251,184,105",12/6/2019,81,"english, hip hop, rap, trap",1066049
134,Arctic Monkeys,Do I Wanna Know?,234,,38,"9,519,123","1,250,364,942",9/9/2013,86,"alternative rock, art rock, baroque pop, british, garage rock, garage rock revival, indie rock, neo-psychedelia, post-punk revival, psychedelic pop, psychedelic rock, sheffield, uk",2682285
135,Ed Sheeran,Shivers,90,23,4,"31,926,382","1,240,024,967",10/25/2021,82,"dance-pop, folk, folk pop, guitarist, music for soccer moms, persian pop, pop, singer, singer-songwriter, soft rock, uk",629312
136,Metro Boomin,Creepin',68,15,2,"36,446,537","1,239,540,881",12/2/2022,81,"hip hop, trap",34477
137,Ed Sheeran,I Don't Care,90,17,1,"58,370,367","1,236,890,080",7/8/2009,55,"dance-pop, folk, folk pop, guitarist, music for soccer moms, persian pop, pop, singer, singer-songwriter, soft rock, uk",86855
138,Post Malone,I Had Some Help (Feat. Morgan Wallen),69,8,3,"66,560,055","1,233,033,416",5/10/2024,81,"2010s, 2020s, alternative r&b, cloud rap, contemporary r&b, country, english, hip hop, pop rap, r&b, trap",604966
139,Imagine Dragons,Demons,244,6,8,"11,240,856","1,232,145,944",9/4/2012,83,"alternative pop, alternative rock, electropop, indie pop, indietronica, nuno, pop, pop rock, rock",1639963
140,Post Malone,Better Now,114,11,1,"40,788,286","1,232,129,792",4/27/2018,80,"2010s, 2020s, alternative r&b, cloud rap, contemporary r&b, country, english, hip hop, pop rap, r&b, trap",993577
141,Calvin Harris,One Kiss,111,14,2,"30,380,257","1,225,387,792",4/6/2018,80,"2010s, dance-pop, edm, electro house, electronic, electropop, festival progressive house, funktronica, late 2000s, nu disco, nu-disco, progressive house, uk hip hop",59882
142,d4vd,Romantic Homicide,111,,17,"17,688,935","1,236,162,909",7/20/2022,88,"2020s, alternative r&b, contemporary r&b, indie pop",1405344
143,DaBaby,ROCKSTAR,72,22,1,"41,679,959","1,215,705,911",6/27/2024,74,"hip hop, southern hip hop",16200
144,Justin Bieber,Peaches,77,14,1,"52,357,127","1,213,245,560",3/19/2021,80,"2010s, 2020s, dance-pop, pop, pop rap, r&b, teen pop",24231
145,Travis Scott,FE!N,84,1,5,"36,391,896","1,206,111,064",7/28/2023,84,"english, experimental hip hop, hip hop, pop rap, rap, southern hip hop, trap",312382
146,Sabrina Carpenter,Taste,55,13,3,"56,201,169","1,201,951,718",5/16/2018,68,"2020s, dance-pop, electropop, pop",1384141
147,Imagine Dragons,Thunder,143,3,8,"21,076,623","1,201,237,576",6/23/2017,85,"alternative pop, alternative rock, electropop, indie pop, indietronica, nuno, pop, pop rock, rock",967273
148,David Kushner,Daylight,72,11,5,"32,418,390","1,196,244,710",4/14/2023,71,"hip hop, rap, pop",732538
149,The Weeknd,The Hills,185,11,3,"14,363,491","1,192,229,116",8/28/2015,86,"hip hop, rap, pop",1949080
